attractionName,reviewerName,reviewTitle,ratings,reviewDate,reviewText,reviewerProfilePicURL,reviewURL
Flower Dome,Ainekett,Beautiful,40,1-Jan-20,"This is beautiful full of flowers from around the world in different sections. It's worth visiting but we came in here AFTER the Cloud dome...and we felt the cloud one was more impressive, I would still come here, but maybe visit here first. Its really cool....very colorful, easy to get around....in an amazing structure!",https://media-cdn.tripadvisor.com/media/photo-l/0d/8a/1a/79/aineplunkett.jpg,https://www.tripadvisor.com.sg/ShowUserReviews-g294265-d4400784-r735889125-Flower_Dome-Singapore.html
Flower Dome,Mary H,Worth a vsit,40,31-Dec-19,So much to see here and amazing colours. Hard to believe you are in a dome. Well organised and to the Cloud experience,https://media-cdn.tripadvisor.com/media/photo-l/1a/f6/ed/ce/default-avatar-2020-7.jpg,https://www.tripadvisor.com.sg/ShowUserReviews-g294265-d4400784-r735814753-Flower_Dome-Singapore.html
Flower Dome,LostALot22,Its nice,40,30-Dec-19,It was a little pricey to get in. And I expected it to be super hot and humid but it was real comfortable. I walked around and looked at the flowers. It took about an hour. It was pretty nice and different from anything I've seen before.,https://media-cdn.tripadvisor.com/media/photo-l/1a/f6/ef/73/default-avatar-2020-13.jpg,https://www.tripadvisor.com.sg/ShowUserReviews-g294265-d4400784-r735561374-Flower_Dome-Singapore.html
Flower Dome,chocolatygudness,Christmas delight!,40,30-Dec-19,"Visited this attraction during the Christmas season and it was just a delight. I've never seen so many poinsettias in one place in my life! I loved the Christmas displays and the beautiful flowers organised in different gardens e.g Australian garden, Mediterranean garden etc.Definitely worth a visit. Don't expect this to be a Botanical garden to see rare floral species. Rather, this is a beautifully arranged air conditioned dome with flowers. It literally is a flower garden.Thoroughly pleasant.",https://media-cdn.tripadvisor.com/media/photo-l/1a/f6/eb/6d/default-avatar-2020-19.jpg,https://www.tripadvisor.com.sg/ShowUserReviews-g294265-d4400784-r735492404-Flower_Dome-Singapore.html
Flower Dome,AJ S,Wow!,40,22-Dec-19,It is a must see in Singapore! That's it! Beautiful and amazing! Never seen something like that before.,https://media-cdn.tripadvisor.com/media/photo-l/1a/f6/ef/73/default-avatar-2020-13.jpg,https://www.tripadvisor.com.sg/ShowUserReviews-g294265-d4400784-r734029450-Flower_Dome-Singapore.html
Flower Dome,gottbart,"Combination of nature, architecture and art",40,15-Dec-19,"Impressive combination of nature, architecture and art in Cloud Forest and Flower Dome, but something was missing... real birds. Instead there were Christmas decorations in December completely not matching interior design..ImponujÄca kombinacja przyrod Forest i Flower Dom, ale czegoÅ mi brakowaÅo... prawdziwych ptakÃ³w. Za to w grudniu byÅa wystawka ÅwiÄteczna kompletnie nie pasujÄca do caÅoÅci zaÅoÅ¼enia.",https://media-cdn.tripadvisor.com/media/photo-l/1a/f6/df/99/default-avatar-2020-40.jpg,https://www.tripadvisor.com.sg/ShowUserReviews-g294265-d4400784-r732674453-Flower_Dome-Singapore.html
Flower Dome,623eyh,lots of examples of plants and artwork,40,6-Dec-19,There are different areas and plants around every corner and it was also interesting to see the different artwork that was added to each display. Something for everyone.,https://media-cdn.tripadvisor.com/media/photo-l/1a/f6/f2/59/default-avatar-2020-24.jpg,https://www.tripadvisor.com.sg/ShowUserReviews-g294265-d4400784-r730872829-Flower_Dome-Singapore.html
Flower Dome,Angela T,Visit with 2 Thai visitors,40,23-Nov-19,I acted as tourist guide for 2 Thai visitors and had a lovely time. The Christmas decorations were out and it's beautiful to see the decorations among the beautiful flowers. We enjoyed the cold in the whole Dome.,https://media-cdn.tripadvisor.com/media/photo-l/16/72/0c/29/caption.jpg,https://www.tripadvisor.com.sg/ShowUserReviews-g294265-d4400784-r728242407-Flower_Dome-Singapore.html
Flower Dome,Nancy M,Special exhibit made it extra interesting,40,20-Nov-19,"The Flower Dome in Gardens by the Bay did not 'wow' me, maybe because I didn't pay extra for the audio tour headset. At around $20 for admission I feel like that should be included. The displays of Mediterranean gardens from Africa, California and elsewhere were interesting but unless you're a true botanist - or take the audio tour which would have probably made it more interesting ' it wasn't fascinating. BUT, the 'Poinsettia Wishes' Garden Trail special exhibit made it worthwhile. A clever, creative and charming floral display in honor of Christmas features 'Nisse,' a little gnome from Scandinavia and his gnome friends and reindeer. Combined with the Christmas music playing in the background it was quite enjoyable.",https://media-cdn.tripadvisor.com/media/photo-o/03/57/86/e9/nancy-m.jpg,https://www.tripadvisor.com.sg/ShowUserReviews-g294265-d4400784-r727669130-Flower_Dome-Singapore.html
Flower Dome,U7144DMmarkb,Welcome to the flower dome,40,14-Nov-19,"This is well worth a visit. The dome itself is worth looking at on its own merits. The mixture of plants and statues is very well done. Various levels gives you great views of all the plants. Great views to be had looking out of the dome and on to the Singapore skyline. Beautifully air conditioned, which is always welcome.",https://media-cdn.tripadvisor.com/media/photo-l/06/b0/4d/e4/mark-b.jpg,https://www.tripadvisor.com.sg/ShowUserReviews-g294265-d4400784-r726317685-Flower_Dome-Singapore.html
Flower Dome,MissL219,Very pretty,40,10-Nov-19,We visited after the Cloud Forest and it was beautiful. Lots of flowers and great photo opportunities.,https://media-cdn.tripadvisor.com/media/photo-l/1a/f6/f1/42/default-avatar-2020-20.jpg,https://www.tripadvisor.com.sg/ShowUserReviews-g294265-d4400784-r725267895-Flower_Dome-Singapore.html
Flower Dome,Pegasus928,A great way to see the colors of the world,40,6-Nov-19,With so many flowers and plants from all corners of the globe the colours and smells are an amazing example of what is good in this world. A slow walk through the numerous displays will leave you inspired and believing you can achieve the impossible in your own little corner back home.,https://media-cdn.tripadvisor.com/media/photo-l/15/3c/d7/36/caption.jpg,https://www.tripadvisor.com.sg/ShowUserReviews-g294265-d4400784-r724395084-Flower_Dome-Singapore.html
Flower Dome,travellers_paradise8,Beautiful,40,2-Nov-19,We visited the flower dome during our visit to Garden by the bay. This dome is located near by the cloud forest dome and its definetly worth a visit. This dome has beautiful flowers and unique art work sculptures made with wood. The flower dome is a must visit to everyone who loves to enjoy the view of beautiful flowers.,https://media-cdn.tripadvisor.com/media/photo-l/1c/1e/bd/07/travellers-paradise8.jpg,https://www.tripadvisor.com.sg/ShowUserReviews-g294265-d4400784-r723185061-Flower_Dome-Singapore.html
Flower Dome,tamsen30,Feast of flowers,40,29-Oct-19,I went during the rhoderdendron display & was mesmerized by the colours. Beautifully displayed & made me want to rush out & buy some for my own garden! The garden rooms with plant habitats from around the world were beautiful. Lots of good places to sit & enjoy the views. I especially liked the sculptures crafted from sticks & other pieces of wood.,https://media-cdn.tripadvisor.com/media/photo-l/1a/f6/e4/ca/default-avatar-2020-51.jpg,https://www.tripadvisor.com.sg/ShowUserReviews-g294265-d4400784-r722299607-Flower_Dome-Singapore.html
Flower Dome,bahiyahmj,I was overwhelmed by the flowers!,40,28-Oct-19,"I came into the dome feeling very overwhelmed by all the flowers in it. It is really beautiful and almost magical. They keep the dome pretty cool probably because of the plants and flowers.The flowers were so so beautiful. Almost with every kind of plants and flowers, I just had to stop and take pictures of it. It was very lovely.Although, this wouldn't be a good place to go if you're allergic to flowers or plants.",https://media-cdn.tripadvisor.com/media/photo-l/0e/8a/47/03/bahiyahmj.jpg,https://www.tripadvisor.com.sg/ShowUserReviews-g294265-d4400784-r721896790-Flower_Dome-Singapore.html
Flower Dome,Sandra B,Colourful flower festival from allover the world,40,26-Oct-19,"The sheer amount of flowers and trees here is just crazy. It is very beautiful, well-maintained and just lovely to be here. Staff clearly put a lot of effort into maintaining this.We enjoyed our time here but must say it's not our favourite. The little alley with the most beautiful flowers got very crowded due to a lot of visitors stopping to take pictures every couple of metres. And we haven't even visited at peak times. Despite that it really is something you should see when visiting Singapore and I would recommend it to everyone.",https://media-cdn.tripadvisor.com/media/photo-l/1a/f6/e2/4a/default-avatar-2020-42.jpg,https://www.tripadvisor.com.sg/ShowUserReviews-g294265-d4400784-r721295461-Flower_Dome-Singapore.html
Flower Dome,Nigel H,Beautiful Colours (but can get crowded),40,25-Oct-19,"Very popular, this is the Flower dome, however I still prefer the Cloud ForestTickets can be purchased outside for the Cloud and Flower Domes. There was a queue, and I would recommend buying tickets from other ticket booths as you arrive to the park, e.g. from the MRTThe temperature inside is perfect and the flower displays are spectacular. The displays change depending on what is being shown. We has the Rhododendrons on display in one of the sections.It is both pushchair and wheelchair friendly, but can get very busy and crowded.The only offputting for me was those inconsiderate visitors who wanted selfies with each display or wanted family photographs as they went around blocking the walkways.Worth a visit - fully recommended",https://media-cdn.tripadvisor.com/media/photo-l/05/e9/8c/a6/nigel-h.jpg,https://www.tripadvisor.com.sg/ShowUserReviews-g294265-d4400784-r721148645-Flower_Dome-Singapore.html
Flower Dome,dutchroger1,Excellent,40,24-Oct-19,Lovely place makes anice break from the heat and very interesting as well. Definitely one for the list of must sees.,https://media-cdn.tripadvisor.com/media/photo-l/01/e5/a7/08/dutchroger1.jpg,https://www.tripadvisor.com.sg/ShowUserReviews-g294265-d4400784-r720862272-Flower_Dome-Singapore.html
Flower Dome,ZN9999,Must visit here,40,21-Oct-19,"We had gone to gardens by the bay the night before, without going here.We certainly are glad we went back to see the 2 domes. It's a bit of a walk so take the inexpensive shuttle if you can.The flower dome is just packed with variety's from all over the world grouped in regions.Very impressive structure from the outside and spacious inside.Lots of girls posing for photos amount the flowers, very Asian.Well worth the visit. Take in the cloud forest also",https://media-cdn.tripadvisor.com/media/photo-l/05/99/b0/c1/mikewak.jpg,https://www.tripadvisor.com.sg/ShowUserReviews-g294265-d4400784-r720049499-Flower_Dome-Singapore.html
Flower Dome,Peck S,Rhododendron Radiance At the Flower Dome,40,21-Oct-19,"The Flower Dome in the Gardens by the BAy is a gigantic, air-conditioned glass greenhouse, showing some of our own floral and other exotic plants and gardens featuring plants from countries like Australia and other semi arid places.From 27th to 28th October the varied varieties of Rhododendrons is displayed and a worthy visit. A definite must for seniores as every first Tuesday of the month, the entry fee is waived.Much effort had been put into the exhibition with adorable bears adorning the display. One would be taken aback by the fusion of colours abound and be amazed by the varieties from the different countries.I was surprised to learn the difference between azaleas and rhododendrons!Another interesting features for SInagporeans especially, is the row of miniature apple trees , laden with apples planted along the side of the walkway.Do go for the exhibition if you want to feast your eyes on the radiance of the rhododendrons!",https://media-cdn.tripadvisor.com/media/photo-l/1a/f6/df/2b/default-avatar-2020-39.jpg,https://www.tripadvisor.com.sg/ShowUserReviews-g294265-d4400784-r720018416-Flower_Dome-Singapore.html
Flower Dome,blue0skye,Nice place and cool.,40,16-Oct-19,"On a hot day this is a place to visit. Plenty of flowers and photo spots. There are a lot of people but angle it properly, you can get some nice photos.",https://media-cdn.tripadvisor.com/media/photo-l/1a/f6/e8/ea/default-avatar-2020-63.jpg,https://www.tripadvisor.com.sg/ShowUserReviews-g294265-d4400784-r718740077-Flower_Dome-Singapore.html
Flower Dome,Blok103,Busy attraction,40,16-Oct-19,"Not sure if there is a best time to visit as this is always busy, but never overcrowded. Great variety of plants and interest in the different country areas",https://media-cdn.tripadvisor.com/media/photo-l/1a/f6/eb/a3/default-avatar-2020-38.jpg,https://www.tripadvisor.com.sg/ShowUserReviews-g294265-d4400784-r718593394-Flower_Dome-Singapore.html
Flower Dome,Gurpreet K,Lovely family attraction,40,15-Oct-19,"They arrangements of the flowers along with the sectioned African, Australian and other plant collection areas are simply superb! This is one place for the pictures - at each step! Make sure to have enough space in your cameras :)",https://media-cdn.tripadvisor.com/media/photo-l/1a/f6/df/99/default-avatar-2020-40.jpg,https://www.tripadvisor.com.sg/ShowUserReviews-g294265-d4400784-r718484761-Flower_Dome-Singapore.html
Flower Dome,John G,Excellent selection of plants and trees,40,13-Oct-19,"This large 'biodome' houses plants and flowers from around the world. It is large enough to contain specimens of a variety of trees, such as Baobab trees. It is very ambitious by trying to cover so many different environments but seems to have produced exhibits that bring the 'flavour' of their home countries. Like so many parts of Singapore, orchids get a lot of attention, with some particularly splendid exhibits to show them off. I particularly liked the way the sculptures have been incorporated in the displays.",https://media-cdn.tripadvisor.com/media/photo-l/1a/f6/e5/2b/default-avatar-2020-52.jpg,https://www.tripadvisor.com.sg/ShowUserReviews-g294265-d4400784-r717910581-Flower_Dome-Singapore.html
Flower Dome,Lewis622015,Refreshing place to visit,40,7-Oct-19,Cool surrounding with bright fresh flowers from top to ground level . A nice stroll with very refreshing decors . Love it and a must-see for all.,https://media-cdn.tripadvisor.com/media/photo-l/06/22/f5/d0/facebook-avatar.jpg,https://www.tripadvisor.com.sg/ShowUserReviews-g294265-d4400784-r715880403-Flower_Dome-Singapore.html
Flower Dome,456karolinas,Nice gardens,40,22-Sep-19,"It's a nice closed small botanic garden not too full of people when we've been there. Love the flowers, especially orchids. Area is divided by different part of world and at the entrance you have more of the fairytale part of it connected to Alice of Wonderland. If you have time see it if no skip and go to Cloud Forest as is in my opinion better",https://media-cdn.tripadvisor.com/media/photo-l/0a/29/0f/4e/karolina-s.jpg,https://www.tripadvisor.com.sg/ShowUserReviews-g294265-d4400784-r711888760-Flower_Dome-Singapore.html
Flower Dome,ratarojo,Nice but if I could only pick one it would be the Cloud Forest,40,14-Sep-19,I had the time so I toured both the cloud forest and flower dome. The flower dome was full of colour and overall was a pleasing place to spend and couple of hours!,https://media-cdn.tripadvisor.com/media/photo-l/02/41/ee/1f/ratarojo.jpg,https://www.tripadvisor.com.sg/ShowUserReviews-g294265-d4400784-r709493833-Flower_Dome-Singapore.html
Flower Dome,Adventurer826249,Flower Dome,40,29-Aug-19,Extensive and beautiful flowers but very crowded on a Sunday afternoon. Not many places to sit for rest. Cloud Forest more impressive.,https://media-cdn.tripadvisor.com/media/photo-l/1a/f6/f0/9f/default-avatar-2020-16.jpg,https://www.tripadvisor.com.sg/ShowUserReviews-g294265-d4400784-r704240177-Flower_Dome-Singapore.html
Flower Dome,shin7788,It's cool if you like flowers...if that's your thing I guess,40,29-Aug-19,But it's a fantastic place to people watch. I could sit there all day in the air con and watch people taking selfies with plants.,https://media-cdn.tripadvisor.com/media/photo-l/0e/96/0f/81/shintaro-s.jpg,https://www.tripadvisor.com.sg/ShowUserReviews-g294265-d4400784-r704082817-Flower_Dome-Singapore.html
Flower Dome,jessbelles,Wandered and Get Lost,40,28-Aug-19,"Inlove with these beautiful flower dome. An amazing array of orchids, a thousand old olive tree, and unusual Baobabs! I will definitely come back and recommend to my family and friends.",https://media-cdn.tripadvisor.com/media/photo-l/09/5f/3a/31/annabelle-s.jpg,https://www.tripadvisor.com.sg/ShowUserReviews-g294265-d4400784-r703737530-Flower_Dome-Singapore.html
Flower Dome,DarrenS344,Must visit,40,27-Aug-19,Visited the flower dome well worth a visit whilst in Singapore.Went to both they are right next to each other.Good to visit in the afternoon the hottest part of the day in Singapore and make sure you stay to watch the light show near by at 7.45.One hour will be sufficient to see each dome.My only complaint would be all the selfie sticks I think they should be banned as some people make you wait while they take 5 minutes to take a photo of themselves.,https://media-cdn.tripadvisor.com/media/photo-l/16/09/b1/3a/darrens344.jpg,https://www.tripadvisor.com.sg/ShowUserReviews-g294265-d4400784-r703445341-Flower_Dome-Singapore.html
Flower Dome,melissa h,Good Enough,40,26-Aug-19,If You like Flower this place is right place for you to take picture with flower but not good if full of people because you can't enjoy this place,https://media-cdn.tripadvisor.com/media/photo-l/0a/ac/11/bd/isabella-h.jpg,https://www.tripadvisor.com.sg/ShowUserReviews-g294265-d4400784-r703213523-Flower_Dome-Singapore.html
Flower Dome,Hilmar Horst D,Photographic delight,40,26-Aug-19,"Took the grand kids to this venue, first stopping at the cloud forest, which they loved to run around in the misting that took place, and trying to get close to the waterfall much to their mums concern. The carnivorous plants warning children will be eaten slowed them down though! We went up into the flower dome, and were delighted by all th trees from various countries, and the massive display of flowers, the beds looking a treat and worthy displays of Singapore's finest orchids that even the kids liked. Although the tree dragon, and various animals made out of dried tree branches kept the little ones interested while the adults appreciated the colourful arrangements. The purple gorilla caught their attention as well, popular photo shoot that one. In fact, you cannot stop taking photo after photo, it just gets to you and you want to remember it.Dont forget to ask for your free gift as you buy your entrance ticket, you will get a pack of souvenir cards that you can send to the rellies to make them jealous, or keep them yourself as a memento of a great day. If a 6 and a 4 year old both enjoy it, then it was a good day all round!",https://media-cdn.tripadvisor.com/media/photo-l/1a/f6/e2/11/default-avatar-2020-41.jpg,https://www.tripadvisor.com.sg/ShowUserReviews-g294265-d4400784-r703077630-Flower_Dome-Singapore.html
Flower Dome,Jok125_1976,Amazing orchid display!,40,18-Aug-19,"Not as impressive as Cloud Forest, however definitely worth seeing if only for Orchid display. With hundreds of orchids in an array of colours this a must see!",https://media-cdn.tripadvisor.com/media/photo-l/18/d2/0a/2f/jasonokeefe1976.jpg,https://www.tripadvisor.com.sg/ShowUserReviews-g294265-d4400784-r700103749-Flower_Dome-Singapore.html
Flower Dome,JamesMichaelNL,Fresh air in a big city!,40,11-Aug-19,"The flower dome is full of amazing plant life, colourful vegetation, and picturesque views. This is a lovely place to take pictures in Singapore, and has the cleanest air we have breathed since coming to Asia! There are plants from all over the world, and the dome is laid out nicely with trails, and views. The only downside is the price of this attraction which costs $20 (for one dome) and $28 if you are doing the cloud forest dome as well (which is in fact much cooler!)",https://media-cdn.tripadvisor.com/media/photo-l/1a/f6/de/0a/default-avatar-2020-35.jpg,https://www.tripadvisor.com.sg/ShowUserReviews-g294265-d4400784-r697816391-Flower_Dome-Singapore.html
Flower Dome,j0g1966,Beautiful Gardens,40,4-Aug-19,The visit to the flower dome was lovely with spectacular gardens representing various regions on Earth. Well worth the visit if you enjoy plants and gardens.,https://media-cdn.tripadvisor.com/media/photo-l/1a/f6/ed/00/default-avatar-2020-4.jpg,https://www.tripadvisor.com.sg/ShowUserReviews-g294265-d4400784-r695314248-Flower_Dome-Singapore.html
Flower Dome,FyingKiwi,Sensory Delight,40,17-Jul-19,"Perhaps a little overshadowed by the neighbouring Cloud Forest, but a delightful place to visit nevertheless. Contained within the dome is a visual feast of flora from areas around the world. Of especial interest was the very large and absolutely delightful collection of varying cacti species. This alone makes a visit all the worth while. Another standout attraction was the scent garden, where visitors are encouraged to enchant themselves with the smell of various orchids.Hidden among much of the flora are alluring sculptures, many of these being made of natural tree vegetation, and unlike their real wildlife forms, are more than willing to be photographed, which you will probably find yourself doing with considerable frequency.",https://media-cdn.tripadvisor.com/media/photo-l/0c/52/5f/8b/fyingkiwi.jpg,https://www.tripadvisor.com.sg/ShowUserReviews-g294265-d4400784-r690207690-Flower_Dome-Singapore.html
Flower Dome,russellw907,Good selection of habitats and plants and some excellent sculptures. We were luck enough to b,40,15-Jul-19,Good collection of habitats and plants and some excellent sculptures. We were lucky enough to be there for a rose display which was colourful and fragrant. Worth a visit.,https://media-cdn.tripadvisor.com/media/photo-l/1a/f6/ea/b2/default-avatar-2020-69.jpg,https://www.tripadvisor.com.sg/ShowUserReviews-g294265-d4400784-r689718834-Flower_Dome-Singapore.html
Flower Dome,christopher s,Get out of the heat and visit the Flower Dome and Cloud Forest.,40,10-Jul-19,"This is part of the Gardens by the Bay complex. Both offer a very relaxing, beautiful and serene setting to spend 2-3 hours and at the same time get out of the extreme heat and humidity. In fact you may want to bring a light jacket because the Cloud Forest ( that is adjacent to the Flower Dome) is very cool at all times. There are other things to do at Gardens by the Bay but these two are the highlights. You need to buy separate tickets for both locations and are right next to each other.",https://media-cdn.tripadvisor.com/media/photo-l/1a/f6/e2/4a/default-avatar-2020-42.jpg,https://www.tripadvisor.com.sg/ShowUserReviews-g294265-d4400784-r688338956-Flower_Dome-Singapore.html
Flower Dome,manojk681,Good place for the flower lovers,40,9-Jul-19,"Once you step in , you will love the place.Full of various flowers.Visited in the evening hence the atmosphere was fantastic.Some flower plants I have seen for the first time.If you are nature lover,you will like the place.Somewhat crowdy place.I like this dome as compared to cloud forest dome",https://media-cdn.tripadvisor.com/media/photo-l/1a/f6/e2/a7/default-avatar-2020-44.jpg,https://www.tripadvisor.com.sg/ShowUserReviews-g294265-d4400784-r688054019-Flower_Dome-Singapore.html
Flower Dome,DarThen,Beautiful and Educational Seasonal Floral Display in the comfort of an air-conditioned Dome,40,6-Jul-19,"Interesting installation that changes every season. Always something new to look forward to, especially the temperate plants (tulips, begonias, roses, alpine, etc.) in a hot and humid tropical city.",https://media-cdn.tripadvisor.com/media/photo-o/03/8f/00/d9/darthen.jpg,https://www.tripadvisor.com.sg/ShowUserReviews-g294265-d4400784-r687238429-Flower_Dome-Singapore.html
Flower Dome,NuJuneK1,A nice place to escape hot weather.,40,5-Jul-19,"Cool place with various flower from around the world, If you like flower photography this place is recommend.",https://media-cdn.tripadvisor.com/media/photo-l/13/1c/a8/c4/nujune-k.jpg,https://www.tripadvisor.com.sg/ShowUserReviews-g294265-d4400784-r686870137-Flower_Dome-Singapore.html
Flower Dome,Ebru A,A Green House of Flower near by the Bay Area,40,2-Jul-19,"It is a nice green house are developed in a park nearby the Bay Area in Singapore. If you like flowers, you can enjoy the time of your visit. You can enter the Flower Dome by buying a ticket which is combined with the Dome of Cloud Forest. The Flower Dome is a large area to host different types pf flowers such as cactus familia, orchids, and roses.",https://media-cdn.tripadvisor.com/media/photo-l/1a/6e/4a/db/ebru-a.jpg,https://www.tripadvisor.com.sg/ShowUserReviews-g294265-d4400784-r685948881-Flower_Dome-Singapore.html
Flower Dome,Django987,Not overly impressed,40,27-Jun-19,It was an interesting place to wander (and to get away from the heat) but it was VERY busy when we went which really detracted from the overall experience. The Cloud Forest is more interesting in my opinion.,https://media-cdn.tripadvisor.com/media/photo-l/1a/f6/de/e7/default-avatar-2020-37.jpg,https://www.tripadvisor.com.sg/ShowUserReviews-g294265-d4400784-r684527983-Flower_Dome-Singapore.html
