attractionName,reviewerName,reviewTitle,ratings,reviewDate,reviewText,reviewerProfilePicURL,reviewURL
Flower Dome,Rykie S,WONDERFUL EXPERIENCE.,50,27-Jan-20,WONDERFUL EXPERIENCE.So beautiful. Every time I went there it was a different display. Lovely and cool inside.,https://media-cdn.tripadvisor.com/media/photo-l/1a/f6/f6/0d/default-avatar-2020-34.jpg,https://www.tripadvisor.com.sg/ShowUserReviews-g294265-d4400784-r741471937-Flower_Dome-Singapore.html
Flower Dome,ricmarknic,Breathtaking,50,26-Jan-20,"Blissful morning spent in the flower dome, it was a must do on our visit to Singapore and didn't disappoint.It was a bargain Â£16 to visit both here and Cloud Forest. The flowers were amazing and cleverly organised into regions of the world",https://media-cdn.tripadvisor.com/media/photo-l/02/57/ac/bf/ricmarknic.jpg,https://www.tripadvisor.com.sg/ShowUserReviews-g294265-d4400784-r741289548-Flower_Dome-Singapore.html
Flower Dome,shapiro360,Amazing smells,50,25-Jan-20,If you were blind and went into this place your nose would explode. I can imagine people with allergies might have a problem in here. It's just as big and beautiful as the cloud forest except there is no waterfall. We got to it late and only had an hour before it closed so we had to rush and we were already tired from walking in the gardens and cloud forest. Its beautiful at night but I would recommend going there first in the daytime then return at night to see it.,https://media-cdn.tripadvisor.com/media/photo-l/1a/c2/4d/eb/avatar.jpg,https://www.tripadvisor.com.sg/ShowUserReviews-g294265-d4400784-r741099825-Flower_Dome-Singapore.html
Flower Dome,Ruben R,Superb,50,22-Jan-20,This place is always in superb shape. The entrance fee is more than justifiable. Never get bored of coming here.,https://media-cdn.tripadvisor.com/media/photo-a/01/aa/12/9c/draghignazzo.jpg,https://www.tripadvisor.com.sg/ShowUserReviews-g294265-d4400784-r740470278-Flower_Dome-Singapore.html
Flower Dome,Moses P,Awesome,50,18-Jan-20,A great place for the whole family. Most impressing display of flowers. Stunning colours of different spices of flowers and beautiful ornaments. The place gets crowded. Early visit is recommended. I am not a gardener or expect in plants and flowers but I enjoyed the sheer beauty of the dome interior and display of fresh flowers.,https://media-cdn.tripadvisor.com/media/photo-l/0f/f6/51/41/moses-p.jpg,https://www.tripadvisor.com.sg/ShowUserReviews-g294265-d4400784-r739787492-Flower_Dome-Singapore.html
Flower Dome,Lynne A,feast of colour and plantlife,50,18-Jan-20,A good couple of hours happily spent walking throughout the DOme checking out all the various plant life inside and hunting for the wooden sculptures around the area. Paths gentle and well spaced. Did not seem as crowded as I had expected. Well worth a visit.Very cool inside against the heat of the day.Roof not a magnifying glass as i had thought it might be.,https://media-cdn.tripadvisor.com/media/photo-l/1a/f6/e8/5b/default-avatar-2020-61.jpg,https://www.tripadvisor.com.sg/ShowUserReviews-g294265-d4400784-r739740863-Flower_Dome-Singapore.html
Flower Dome,Kristycambodia,Stunning,50,16-Jan-20,This place was so beautiful!! Well worth the money. Be sure to visit all of the gardens. There are some which are free. If you are there at Christmastime don't miss out on the winter wonderland music light show and festivities. It was a highlight. They even made it snow!,https://media-cdn.tripadvisor.com/media/photo-l/1a/f6/df/2b/default-avatar-2020-39.jpg,https://www.tripadvisor.com.sg/ShowUserReviews-g294265-d4400784-r739398949-Flower_Dome-Singapore.html
Flower Dome,VRNPerth,Flower dome.,50,13-Jan-20,"It is definitely worth the entrance price. You can either buy a ticket for each of the three attractions or a combination of two or three of them. The Flower Dome, the Cloud Forest and I don't remember the third one. Buying a combination of three entitles you to use the shuttle service running inside the gardens. You can still avail of the shuttle without this, but by buying a ticket each time you want to use the shuttle.As with the Super Tree grove I don't have much to say about the attraction. It is really beautiful. We were on a trip by ourselves for the first time in 18-20 years. The kids have now grown up enough to travel by themselves or be left at home. We spent a couple of hours inside the Flower dome just walking around looking at the various displays. No hassling kids, no hunger pangs, no toilet breaks.But please be aware that going on a weekend will mean that there are a whole lot of girls/women who work in Singapore who come here for a picnic and will be taking selfies at every possible point in the dome. Walking around can be a bit tricky, avoiding photo bombing will need to be a skill you'll need to learn quickly.Am posting a few photos of the place, instead of saying anything much about the attraction itself.",https://media-cdn.tripadvisor.com/media/photo-l/1a/f6/f3/7c/default-avatar-2020-29.jpg,https://www.tripadvisor.com.sg/ShowUserReviews-g294265-d4400784-r738839435-Flower_Dome-Singapore.html
Flower Dome,Michael T,Excellent display of plants and trees,50,13-Jan-20,The dome itself is quite spectacular and provides a wonderful setting for an extensive range of flora. We found the cacti and succulents particularly interesting with some unusual specimens which I don't recall seeing in Kew. There were some ancient olive trees with interesting gnarled bark and some very impressive massive dahlias.,https://media-cdn.tripadvisor.com/media/photo-l/08/16/28/77/michael-t.jpg,https://www.tripadvisor.com.sg/ShowUserReviews-g294265-d4400784-r738755916-Flower_Dome-Singapore.html
Flower Dome,tknight272010,Flower persons delight,50,13-Jan-20,The flower garden is an amazing place to visit with it's displays and scents gives the eye a visual treat.,https://media-cdn.tripadvisor.com/media/photo-l/1a/f6/f4/5d/default-avatar-2020-32.jpg,https://www.tripadvisor.com.sg/ShowUserReviews-g294265-d4400784-r738693939-Flower_Dome-Singapore.html
Flower Dome,Trang L,Amazing Flower Dome,50,6-Jan-20,It is a really spectacular construction of the world. Millions of plants are here. You do not need to go many places to see.,https://media-cdn.tripadvisor.com/media/photo-l/1a/f6/ef/9c/default-avatar-2020-14.jpg,https://www.tripadvisor.com.sg/ShowUserReviews-g294265-d4400784-r737165952-Flower_Dome-Singapore.html
Flower Dome,KylieIsTravelling,Return visit - must see in Singapore,50,4-Jan-20,"The Flower Dome is a must see in Singapore, and best thing to do is get the combined ticket with the Cloud Forest.The Flower Dome is set out with various display sections for different countries (e.g. Australia, America) and different types of plants e.g. succulents and herbs.They've usually got a themed display down on the bottom level depending on what time of year it is - I went at Christmas time and they had a great Christmas display.Well worth the entry to visit.",https://media-cdn.tripadvisor.com/media/photo-l/08/ff/28/4b/kylieistravelling.jpg,https://www.tripadvisor.com.sg/ShowUserReviews-g294265-d4400784-r736662963-Flower_Dome-Singapore.html
Flower Dome,motiver2018,"Flowers, Flowers, everywhere...",50,2-Jan-20,"This is my favorite place to go for macro-photography of flowers, especially as a beginner. There's no wind to disrupt focusing the lens, except that you have to content with the number of visitors. I can spend almost three hours here each time. In fact every visitors would leave with many photos on their phones or cameras clamoring for a good shot here and there.There is also a cafe inside this place. Very cosy and relaxing for a cup of coffee/tea, or for some reflections in a 'flowery' environment. There is also a big function hall that seem open for corporate booking. The variety of plants/flowers amazes you and there is so much to learn or admire at the beauty of nature.",https://media-cdn.tripadvisor.com/media/photo-l/14/c9/a2/5c/motiver2018.jpg,https://www.tripadvisor.com.sg/ShowUserReviews-g294265-d4400784-r736065885-Flower_Dome-Singapore.html
Flower Dome,fajaradiartha,Dome of plants,50,30-Dec-19,I advise going here first before Cloud Forest. The Flower Dome is simply a collection of plants from many countries. I believe they regulate the climate and humidity to make it similar to countries in sub-tropical region. The place is beautifully designed. Must visit here if you ever go to Garden by the Bay. Come here first before the Cloud Forest because the latter is even better.,https://media-cdn.tripadvisor.com/media/photo-l/08/46/53/71/fajaradiartha.jpg,https://www.tripadvisor.com.sg/ShowUserReviews-g294265-d4400784-r735515810-Flower_Dome-Singapore.html
Flower Dome,Ling_Sg,Favourite place to bring tourists,50,30-Dec-19,Flower Dome and Cloud forest are favourite place to bring tourists. My friends from overseas enjoy and love the place. It's a place where I won't get sick of myself. Beautiful flowers and environment,https://media-cdn.tripadvisor.com/media/photo-a/01/b9/c1/89/ling-sg.jpg,https://www.tripadvisor.com.sg/ShowUserReviews-g294265-d4400784-r735497495-Flower_Dome-Singapore.html
Flower Dome,Thomas J,"A heavenly kingdom of plants, trees and flowers from all over the world - 'a green globe' in a giant indoor 'miniature'!",50,28-Dec-19,"What does not grow here does not exist on Earth (well ...). An attempt to recreate large parts of the botanical world, gathered in one place with educational guidance. May personally think that is the best example I have seen and experienced so far. Well-maintained, beautiful, content-rich, comprehensive, educational, exciting, interesting and important from an educational point of view. Especially at a time when the climate and environment are becoming more reminiscent and we all need to reflect on what is important in life and important to our planet. If you 'just' want to see and experience ten things in Singapore, this is definitely one of them!",https://media-cdn.tripadvisor.com/media/photo-l/06/27/ea/a4/thomas-j.jpg,https://www.tripadvisor.com.sg/ShowUserReviews-g294265-d4400784-r734935651-Flower_Dome-Singapore.html
Flower Dome,john h,Stunning,50,22-Dec-19,One ticket for this and the forest - great value. Bautiful layout with many little surprises hidden in the displays - keep your eyes open. Smashing restaurant inside with excellent range of snacks and meals.,https://media-cdn.tripadvisor.com/media/photo-l/0d/01/99/3e/john-h.jpg,https://www.tripadvisor.com.sg/ShowUserReviews-g294265-d4400784-r734025581-Flower_Dome-Singapore.html
Flower Dome,Jaideelion,Size and sights,50,19-Dec-19,Gardens are very well done. You see plants that probably will never see in an air conditioned dome. The paths and movement directions are well co-ordinated and take a lot of selfies,https://media-cdn.tripadvisor.com/media/photo-l/1a/f6/ea/74/default-avatar-2020-68.jpg,https://www.tripadvisor.com.sg/ShowUserReviews-g294265-d4400784-r733542544-Flower_Dome-Singapore.html
Flower Dome,TonyNguyen1102,Excellent,50,16-Dec-19,"A must - go - place in Singapore.Many beautiful trees and flowers, good decoration. They have new event every 3 months, so you should come back ofen. I came near Chrismast, it is good.",https://media-cdn.tripadvisor.com/media/photo-l/1a/27/e3/bc/tonynguyen1102.jpg,https://www.tripadvisor.com.sg/ShowUserReviews-g294265-d4400784-r733005583-Flower_Dome-Singapore.html
Flower Dome,Judy K,If you only have time for one exhibit choose this one,50,15-Dec-19,Twenty Singapore dollars for a single admission ($15 US) is a good price for this beautiful indoor exhibit at the Gardens by the Bay. It is expansive and you could easily spend a couple of hours strolling amidst the manicured plant exhibits and special displays.,https://media-cdn.tripadvisor.com/media/photo-l/06/f1/a5/0a/peter-r.jpg,https://www.tripadvisor.com.sg/ShowUserReviews-g294265-d4400784-r732773753-Flower_Dome-Singapore.html
Flower Dome,David H,Great addition for the gardens,50,12-Dec-19,"This optional extra place to visit is a great addition of the Gardens by the Bay complex. It is divided into geological areas such as Australian, South American, etc We visited during the lead up to Christmas so this was reflected in certain displays as well.",https://media-cdn.tripadvisor.com/media/photo-l/07/50/01/3b/david-h.jpg,https://www.tripadvisor.com.sg/ShowUserReviews-g294265-d4400784-r732175718-Flower_Dome-Singapore.html
Flower Dome,alan P,Amazing World of Plants,50,11-Dec-19,"If you are into gardening and would like to see how to set out plantings especially of not so common plants and trees this is the place to viist.The succulent garden is wonderful, as is the Australian Garden.The lower garden area was themed as a Christmas Garden with all the plants and decorations.,",https://media-cdn.tripadvisor.com/media/photo-l/1a/f6/ed/7b/default-avatar-2020-6.jpg,https://www.tripadvisor.com.sg/ShowUserReviews-g294265-d4400784-r731910886-Flower_Dome-Singapore.html
Flower Dome,janesU8858TY,Flower Dome,50,11-Dec-19,Beautiful gardens of different regions on show. Many had Christmas exhibits . Stunningly Beautiful. I could have stayed there all day.,https://media-cdn.tripadvisor.com/media/photo-l/1a/f6/f3/7c/default-avatar-2020-29.jpg,https://www.tripadvisor.com.sg/ShowUserReviews-g294265-d4400784-r731895816-Flower_Dome-Singapore.html
Flower Dome,KYHENG,Large flower collection,40,14-Mar-21,"Kudos to the designers who put together this huge collection of flowers in a man made air conditioned dome. The keywords here are huge collection and air conditioned. I cannot imagine the number of hours of design time that must have gone in to arrange the flowers within the dome for us to meander in leisure. Of course the part I enjoyed most is the air condition especially after a hot day wandering around the outdoor gardens, this is definitely a place to plan at the end of your trip to the Gardens by the Bay!We were also very lucky to come just in time for the cherry blossoms displays.Allow about an hour or so, depending on your attraction for flowers.",https://media-cdn.tripadvisor.com/media/photo-l/1c/c4/8b/75/kyheng.jpg,https://www.tripadvisor.com.sg/ShowUserReviews-g294265-d4400784-r784517804-Flower_Dome-Singapore.html
Flower Dome,Travelove58,"An exotic world of plants & flowers, all in one place.....",40,21-Feb-21,"Huge varieties of exotic & beautiful plants & flowers from all over the world in one place. Most people probably never get to see most of such unusual plants & flowers in their lifetime.Admire & view them in cool air-conditioned comfort.Not sure if there is another place like this in the world. This being CNY, added theme props adds colour to the place.Sadly though due COVID, this usually tourists- packed attraction is quiet, with some local visitors.",https://media-cdn.tripadvisor.com/media/photo-l/1a/f6/e4/2d/default-avatar-2020-48.jpg,https://www.tripadvisor.com.sg/ShowUserReviews-g294265-d4400784-r783279808-Flower_Dome-Singapore.html
Flower Dome,koloblicin_lee,Better to visit during the day,40,18-Dec-20,"Had a lovely time with my girlfriend at night to see the Christmas decorations and it was definitely quite lovely to see all the night lights. However, some portions of the flower dome is quite dimly lit so you cannot appreciate the beauty and colours of the flowers as well as during the day. So definitely go during the day to see the flowers but stick around till night to see the Christmas lights.",https://media-cdn.tripadvisor.com/media/photo-l/1b/ce/b4/33/koloblicin-lee.jpg,https://www.tripadvisor.com.sg/ShowUserReviews-g294265-d4400784-r779450596-Flower_Dome-Singapore.html
Flower Dome,henghown,September Flowers,40,30-Sep-20,Any time of the day can visit Flower Dome as it roofed. Don't worry about rain or sun. Attached photos are Flowers can be seem during the September time. Take your time to enjoy the flowers of the season.,https://media-cdn.tripadvisor.com/media/photo-l/16/98/08/f5/avatar.jpg,https://www.tripadvisor.com.sg/ShowUserReviews-g294265-d4400784-r772458517-Flower_Dome-Singapore.html
Flower Dome,Leaamor38,Amazing experience at flower dome singapore,40,15-Sep-20,"Closed up look to the beautiful flowers in flower dome singapore.Very cool environment ,makes your mood happy because of the flowers",https://media-cdn.tripadvisor.com/media/photo-l/1a/f6/f1/06/default-avatar-2020-18.jpg,https://www.tripadvisor.com.sg/ShowUserReviews-g294265-d4400784-r770345546-Flower_Dome-Singapore.html
Flower Dome,KGB777,Always most impressive,40,20-Jun-20,"Last visit here was in March 2020 before everything closed down for the lockdown. But it was quite a nice time to visit as there were very few other people inside, and unlike the cloud forest there are regular changes in the flowers on display. We have our annual passes so it's always enjoyable to come in here and escape the heat outside.",https://media-cdn.tripadvisor.com/media/photo-l/05/35/2d/07/kgb777.jpg,https://www.tripadvisor.com.sg/ShowUserReviews-g294265-d4400784-r757736438-Flower_Dome-Singapore.html
Flower Dome,KJJ1901,Take a jacket!,40,9-May-20,It's surprisingly chilly in the Flower Dome so take a jacket for your own comfort. We were lucky enough to go around here during Chinese New Year and the intricate flower artwork was stunning. There are beautiful displays of succulents and cacti on multilevel platforms.The floor surface and lifts would allow easy access for wheelchairs/ trolleys.,https://media-cdn.tripadvisor.com/media/photo-l/1b/50/1f/c6/kjj1901.jpg,https://www.tripadvisor.com.sg/ShowUserReviews-g294265-d4400784-r753382256-Flower_Dome-Singapore.html
Flower Dome,Marcusmeow,Nice atmosphere,40,25-Mar-20,Went there on 22 mar and was pleasantly surprised to find lesser crowds and beautiful sakura flowers on display. There are also Japanese yukatas for rent during this period. Will definitely go again.,https://media-cdn.tripadvisor.com/media/photo-l/1a/51/24/b3/marcusmeow.jpg,https://www.tripadvisor.com.sg/ShowUserReviews-g294265-d4400784-r751791135-Flower_Dome-Singapore.html
Flower Dome,Dennis K,2 hrs in flower dome,40,6-Mar-20,"Dont missed the desert part of the dome, it is fantasic and well impressed. the major part of the flower garden is not interest at all.",https://media-cdn.tripadvisor.com/media/photo-l/1a/f6/f1/42/default-avatar-2020-20.jpg,https://www.tripadvisor.com.sg/ShowUserReviews-g294265-d4400784-r749343400-Flower_Dome-Singapore.html
Flower Dome,christineworden,flower dome,40,24-Feb-20,well worth the money and time spent here. such an array of plants. a lot of cacti in the gardens but if you have time it is a great walk and sight.,https://media-cdn.tripadvisor.com/media/photo-s/01/2e/70/86/avatar007.jpg,https://www.tripadvisor.com.sg/ShowUserReviews-g294265-d4400784-r747158315-Flower_Dome-Singapore.html
Flower Dome,mival25,A great place for flower lovers!,40,24-Feb-20,"I enjoyed the flower dome although personally I preferred The Cloud Forest. If you've never been before, buy a combo ticket which allows entry to both domes.",https://media-cdn.tripadvisor.com/media/photo-l/1a/f6/de/5a/default-avatar-2020-36.jpg,https://www.tripadvisor.com.sg/ShowUserReviews-g294265-d4400784-r747015343-Flower_Dome-Singapore.html
Flower Dome,colin u,Great place to cool down in the afternoon.,40,16-Feb-20,Great place to cool down in the afternoon. Lots of interesting plants and flowers in a magnificent building.,https://media-cdn.tripadvisor.com/media/photo-l/04/77/ed/2d/colin-cameron1.jpg,https://www.tripadvisor.com.sg/ShowUserReviews-g294265-d4400784-r745435150-Flower_Dome-Singapore.html
Flower Dome,kikikyo,Preferred the cloud dome as less stairs,40,12-Feb-20,Honestly I loved how beautiful the flowers were and such interesting plants like the succulents and the hairy looking cactus.. please excuse my lack of knowledge as I went with my toddler who was mesmerized without me having to read the names and descriptions out. BUT a tad too many stairs for me to carry my toddler around. Better to go cloud dome if you are with smaller kids. This is better for teenagers!,https://media-cdn.tripadvisor.com/media/photo-l/15/8c/56/ad/kikikyo.jpg,https://www.tripadvisor.com.sg/ShowUserReviews-g294265-d4400784-r744629711-Flower_Dome-Singapore.html
Flower Dome,yps0909,Great indoor garden,40,12-Feb-20,We purchased the combo ticket that included the Cloud Forest and the Flower Dome. But I preferred the Cloud Forest though.Indoor garden great to avoid either the heat of sunny day or pouring rain outside.,https://media-cdn.tripadvisor.com/media/photo-l/1a/f6/df/2b/default-avatar-2020-39.jpg,https://www.tripadvisor.com.sg/ShowUserReviews-g294265-d4400784-r744540770-Flower_Dome-Singapore.html
Flower Dome,digitalroc,For Flower and Plant Enthusiasts,40,10-Feb-20,"I purchased the combo ticket that included the Flower Dome and the Cloud Forest for a price of $28 SGD. The Flower Dome is very colourful inside, there are flowers and plants from all over the world, each area is unique to a specific region in the world. A worthy note, the Flower Dome is the largest glass greenhouse in the world, you have to see it to believe it!",https://media-cdn.tripadvisor.com/media/photo-l/02/3b/8b/77/digitalroc.jpg,https://www.tripadvisor.com.sg/ShowUserReviews-g294265-d4400784-r744024469-Flower_Dome-Singapore.html
Flower Dome,julian c,Colourful,40,8-Feb-20,"Not quite as good as the Cloud Dome but still worth a visit. Set out in different zones from around the world including Mediterranean and Australia. Ticket queues can be a bit slow, so would recommend buying in advance.",https://media-cdn.tripadvisor.com/media/photo-l/15/52/cd/97/julian-c.jpg,https://www.tripadvisor.com.sg/ShowUserReviews-g294265-d4400784-r743701144-Flower_Dome-Singapore.html
Flower Dome,YashS740,Good,40,26-Jan-20,This is next to Cloud forest while visiting the Gardens by the Bay. It has all sorts of flowers belonging to different regions.I would prefer cloud Forest first if i am running short of time,https://media-cdn.tripadvisor.com/media/photo-l/0e/6c/25/75/yash-s.jpg,https://www.tripadvisor.com.sg/ShowUserReviews-g294265-d4400784-r741149246-Flower_Dome-Singapore.html
Flower Dome,alpatdunc,Very pretty,40,25-Jan-20,This is worth buying a ticket for with the Cloud Dome as they are next to each other. It is lovely to walk around and the displays are pretty. We were there when they were starting to set up for Chinese New Year but all the Christmas displays were still in there.,https://media-cdn.tripadvisor.com/media/photo-l/1a/f6/ea/74/default-avatar-2020-68.jpg,https://www.tripadvisor.com.sg/ShowUserReviews-g294265-d4400784-r741062550-Flower_Dome-Singapore.html
Flower Dome,Fred T,Plants from mediterranean climate areas around the world; not many flowers,40,20-Jan-20,"This is mainly about the mediterranean climate areas around the world. In addition, there is a small section that changes with the time of year (was Xmas theme in early January). The orchid section was small and crowded. Most areas have few flowers. Buy the combined dome ticket. Took about an hour to see.",https://media-cdn.tripadvisor.com/media/photo-l/1a/f6/ee/10/default-avatar-2020-8.jpg,https://www.tripadvisor.com.sg/ShowUserReviews-g294265-d4400784-r740164310-Flower_Dome-Singapore.html
Flower Dome,FarAway746712,Pretty but just okay,40,19-Jan-20,"Been there, done that, won't go back. Pretty flower display. Not very exciting nor awe inspiring, unlike Cloud Forest.",https://media-cdn.tripadvisor.com/media/photo-l/1a/f6/ea/b2/default-avatar-2020-69.jpg,https://www.tripadvisor.com.sg/ShowUserReviews-g294265-d4400784-r739905642-Flower_Dome-Singapore.html
Flower Dome,Regina302,Really Good,40,16-Jan-20,"Been here at 4pm-6pm so I can enjoy this garden from natural green color and mix it with lots of lights. The place was really good too, like cloud forest but this one focus on flowers and all. I really like cactus section because I don't really into flowers. You can take so many good picture here.",https://media-cdn.tripadvisor.com/media/photo-o/07/c7/26/fa/regina302.jpg,https://www.tripadvisor.com.sg/ShowUserReviews-g294265-d4400784-r739419201-Flower_Dome-Singapore.html
Flower Dome,AirFuss,Treat for your eyes,40,16-Jan-20,"We have visited this place twice and both the times it had a different theme setup. Both were beautiful and colorful.Inside the dome there are trees, various plants with beautiful flowers and cactuses for display.",https://media-cdn.tripadvisor.com/media/photo-l/19/26/4f/fd/airfuss.jpg,https://www.tripadvisor.com.sg/ShowUserReviews-g294265-d4400784-r739358722-Flower_Dome-Singapore.html
Flower Dome,Patmar2501,lovely!,40,11-Jan-20,We were there at Christmas so the Flower Dome had it's Christmas displays out. A great display! Our favourite was the cloud dome though.,https://media-cdn.tripadvisor.com/media/photo-l/1a/f6/e2/11/default-avatar-2020-41.jpg,https://www.tripadvisor.com.sg/ShowUserReviews-g294265-d4400784-r738367562-Flower_Dome-Singapore.html
Flower Dome,Gillian L,Enjoyed our visit to the Flower Dome.,40,9-Jan-20,"The Dome is well laid out with a good range of flora set in gardens from around the world including Australia, South Africa, Southern Europe etc. Some extremely old olive tree were of particular interest.",https://media-cdn.tripadvisor.com/media/photo-l/1a/f6/de/0a/default-avatar-2020-35.jpg,https://www.tripadvisor.com.sg/ShowUserReviews-g294265-d4400784-r738044760-Flower_Dome-Singapore.html
