attractionName,reviewerName,reviewTitle,ratings,reviewDate,reviewText,reviewerProfilePicURL,reviewURL
Jewel Changi Airport,yueqiaosm,Fantasic,50,13-Feb-21,"Extremely beautiful and seems to come into a fairyland. Just pity is the park is not big, just half of the circle.",https://media-cdn.tripadvisor.com/media/photo-l/05/bc/7b/49/yueqiaosm.jpg,https://www.tripadvisor.com.sg/ShowUserReviews-g294265-d17237163-r782779272-Jewel_Changi_Airport-Singapore.html
Jewel Changi Airport,HenrikWalther,Fantastic vue,50,27-Jan-21,when having waiting time in Changi airport don't miss this fantastic waterfall. We even had time for breakfast in this amasing area.,https://media-cdn.tripadvisor.com/media/photo-l/0c/37/80/83/henrikflygerw.jpg,https://www.tripadvisor.com.sg/ShowUserReviews-g294265-d17237163-r781844019-Jewel_Changi_Airport-Singapore.html
Jewel Changi Airport,wesleywaisiu,Best mall in Singapore,50,30-Dec-20,"Jewel is the best shopping mall for an airport around the world, as people said. It is also the best shopping mall in Singapore in my opinion.Firstly, the world biggest waterfall and the Show has already attracted all the eyeballs. The train that run through the building is awesome, although it's closed now.You can find all kinds of shops there. The restaurant choices are one of the most in the area, with all kinds of cuisine, from cheap to expensive. Cinema, hotel, indoor playground, supermarkets, Changi experience, a lot of parking space, it has all the things you need.The only drawback is the crowd, sometimes the 1000+ parking space will be all full, and hard to find a seat even with so many restaurants. And it's quite far to walk to T2 or T3 for the MRT station.",https://media-cdn.tripadvisor.com/media/photo-l/1a/f6/ea/b2/default-avatar-2020-69.jpg,https://www.tripadvisor.com.sg/ShowUserReviews-g294265-d17237163-r780214907-Jewel_Changi_Airport-Singapore.html
Jewel Changi Airport,LUVBALIBEACH,A Great Alternative Mall to shop and dine till you drop and add on calories.,50,23-Dec-20,"We stayed at airport hotel cos we wanted to visit Jewel.It was a good choice to stay a night so no rush to see everything here.We came earlier before hotel's check in at 3pm. We had lunch at shake shack.Then started shopping immediately. There were 5 floors in all plus 2 basements.Shops are concentrated on 1 to 4, 5th is more entertainment, bars and food outlets. Level 4 mostly for kids shopping.B1 B2 food restaurants and some retail shops too.We shop at Desigual, Muji, Footlocker, ShirtBar, Zara, Marks and Spencer, etc.There were some designer shops like Moschino, Furla, Katespade, etc but since we can get these in towns, we look for unique shops. DESIGUAL has limited edition items only at Jewel when items are first launched. By the time items move to the town stores, items could be sold out.The shops are lined up in a circle so just walk and you end up at the starting point again. There are some restaurants or food shops in some of the levels so you can still dine then shop again on same level.We tried JW360 for dinner, Shake Shack for lunch, Paris Baquette for Tea Time and had ice cream at birds of paradise. Now, you see where the calories go?We just stroll floor by floor so easy to complete and not miss any shop.At level 5 we pay to visit the evening christmas garden so we can take some great photos. There is even a camp site on this level where you can rent a tent just for fun. We had already booked a hotel.The best part in Jewel is of course, the atrium with waterfall. At 630pm, there is the train going around the waterfall, snow flakes flying plus smoke effect. Just good photo session. Then 730pm, they have the light and music show. The sound of the water crashing down, colour changing plus music make this, a spectacular event!There is even a SHAW movie theatre so if visitors had a short stopover, they could watch a movie here.We love this place cos there is so much to see and do. Or even if you just want to waste time here, it can also help you to destress.There should be an airport shuttle just to bring people from town to here in a swift. That is, express airport shuttle.Overall, fantastic place to visit cos no tourists and thus not overly crowded.A good escape if time permits.",https://media-cdn.tripadvisor.com/media/photo-l/03/4e/24/bc/luvbalibeach.jpg,https://www.tripadvisor.com.sg/ShowUserReviews-g294265-d17237163-r779770288-Jewel_Changi_Airport-Singapore.html
Jewel Changi Airport,roniiskandarP,The Jewel of Singapore,50,16-Dec-20,"Great place to venture, alot of shops, cafe and much more, great for shopping and varieties of food to choose for.",https://media-cdn.tripadvisor.com/media/photo-l/08/53/06/39/roni-alexander-p.jpg,https://www.tripadvisor.com.sg/ShowUserReviews-g294265-d17237163-r779306219-Jewel_Changi_Airport-Singapore.html
Jewel Changi Airport,ZahidahTifny,Kudos to Mr Abdul!,50,10-Dec-20,"We were walking around at approx 9.30am at Jewel to find places to eat. As we were searching at the directory, the Jewel staff approached us and informed us that most of the eateries will open approximately at 10.30am. Those that were already open are non-halal options.He gave many suggestions on where to go and what to eat and assured us that we will enjoy our visit here.Thank you for being proactive and going out of the way to speak to us while on his cleaning duty. Please convey my thanks to Mr Abdul (I hope I remember his name correctly).",https://media-cdn.tripadvisor.com/media/photo-l/0e/cf/22/ff/zahidahtifny.jpg,https://www.tripadvisor.com.sg/ShowUserReviews-g294265-d17237163-r778877899-Jewel_Changi_Airport-Singapore.html
Jewel Changi Airport,H8400ZJjeanl,Will go again,50,4-Dec-20,Amazing... My kids absolutely loved it here. Such a fun place to go and will definitely go there again.,https://media-cdn.tripadvisor.com/media/photo-l/1a/f6/7c/01/default-avatar-2020-5.jpg,https://www.tripadvisor.com.sg/ShowUserReviews-g294265-d17237163-r778415663-Jewel_Changi_Airport-Singapore.html
Jewel Changi Airport,CinFok,Interesting & wonderful experience,50,29-Nov-20,Had a sparkling time at Jewel! Like the Manual Life sky net walking! Had a thrilling good time. The staff there were also friendly and helpful.,https://media-cdn.tripadvisor.com/media/photo-l/1a/f6/77/ae/default-avatar-2020-2.jpg,https://www.tripadvisor.com.sg/ShowUserReviews-g294265-d17237163-r778106471-Jewel_Changi_Airport-Singapore.html
Jewel Changi Airport,Thomas V,The Best Airport in the World,50,23-Oct-20,"This is the most beautiful and best functioning airport I have ever been to, and I have been to very many. It is quite impressive as everything works so well. Lost of shops, restaurants and lounges and lots of open spaces. And the design is modern and beautiful. A pleasure to pass through.",https://media-cdn.tripadvisor.com/media/photo-l/1a/f6/e3/1f/default-avatar-2020-46.jpg,https://www.tripadvisor.com.sg/ShowUserReviews-g294265-d17237163-r775267375-Jewel_Changi_Airport-Singapore.html
Jewel Changi Airport,Curious265314,Really impressive,50,15-Oct-20,Really beautiful airport. The waterfall portion isn't exactly inside the airport but they make it pretty accessible for travelers to visit. If you're only doing a quick layover at the airport and want to see the waterfall you can take the tram that drives by it. We came to the airport early just to check it out. You can even check your bags in there so you can walk around..just make sure you leave enough time to do all of it and get to your gate on time.,https://media-cdn.tripadvisor.com/media/photo-l/1c/2c/bf/4b/curious265314.jpg,https://www.tripadvisor.com.sg/ShowUserReviews-g294265-d17237163-r774329421-Jewel_Changi_Airport-Singapore.html
Jewel Changi Airport,leavlte,Incredible,50,16-Sep-20,"At first bought the bundle ticket in order to do all activities and we thought that it was quite price : but it definitely worths every penny !All activities were very funny and adapted for kids and big kids.Each part is very different from the others so it's not boring and you can spend many hours there. The mall is also full of amazing shops and they are plenty of good restaurants , it's such a good destination for a rainy Singaporean day.",https://media-cdn.tripadvisor.com/media/photo-l/1a/f6/ea/74/default-avatar-2020-68.jpg,https://www.tripadvisor.com.sg/ShowUserReviews-g294265-d17237163-r770471899-Jewel_Changi_Airport-Singapore.html
Jewel Changi Airport,Leaamor38,Jewel Changi airport,50,15-Sep-20,That place is extraordinary.Im so amze with the vortex cant keep my eyes of it.Its very clean and very cool,https://media-cdn.tripadvisor.com/media/photo-l/1a/f6/f1/06/default-avatar-2020-18.jpg,https://www.tripadvisor.com.sg/ShowUserReviews-g294265-d17237163-r770369126-Jewel_Changi_Airport-Singapore.html
Jewel Changi Airport,PritiLondon,Great customer service - lost car!,50,11-Sep-20,I'd like to highly commend Carissa Santos from the Jewel Guest Centre who very kindly helped us find our car. Carissa noticed that I was repeating my steps when trying to locate our car in the car park and went out of her way to find me and assist me in finding my car. She was kind enough to spend a good 20 minutes helping us and even ensured we were safely in our car before saying goodbye. She went above and beyond what I expected - thank you Carissa!,https://media-cdn.tripadvisor.com/media/photo-l/02/1a/a5/1a/pritilondon.jpg,https://www.tripadvisor.com.sg/ShowUserReviews-g294265-d17237163-r769791659-Jewel_Changi_Airport-Singapore.html
Jewel Changi Airport,jackytansg,The Best Airport in the World,50,17-Aug-20,"As a Singaporean, I'm proud to live in a country with the best airport in the world. You can spend the whole day at Jewel and you will still not feel that it is enough. Take your time and relax by the waterfall. The view of the waterfall, is best in any level you are at.",https://media-cdn.tripadvisor.com/media/photo-l/1b/d3/88/05/avatar.jpg,https://www.tripadvisor.com.sg/ShowUserReviews-g294265-d17237163-r765308617-Jewel_Changi_Airport-Singapore.html
Jewel Changi Airport,will93weili,Feel like an indoor Jurassic Park,50,1-Aug-20,"I was an engineer for the project. Despite the fact that I have worked at the very same place on daily basis for almost 3 years, it never failed to amaze me every time I visit. Not sure about other, but it always reminds me of the Jurassic Park, of course, without the dinosaurs.",https://media-cdn.tripadvisor.com/media/photo-l/07/24/f1/e4/will-w.jpg,https://www.tripadvisor.com.sg/ShowUserReviews-g294265-d17237163-r762516086-Jewel_Changi_Airport-Singapore.html
Jewel Changi Airport,bhodgkinson,Awesome!,50,21-Jun-20,I visited the Jewel as I was early for my flight - it is well worth a visit! I payed to enter the gardens and to visit the Canopy Bridge - its crazy this is in an airport!,https://media-cdn.tripadvisor.com/media/photo-l/1b/6f/50/f6/caption.jpg,https://www.tripadvisor.com.sg/ShowUserReviews-g294265-d17237163-r757808938-Jewel_Changi_Airport-Singapore.html
Jewel Changi Airport,rohansirsi,Great Experience,50,13-Jun-20,This place so beautiful that we are speechless about it. This place is marvelous an indoor waterfall and forest. This place located at terminal-1 of Changi airport. I strongly recommend all tourists to visit this place.,https://media-cdn.tripadvisor.com/media/photo-l/1b/5a/dc/05/rohansirsi.jpg,https://www.tripadvisor.com.sg/ShowUserReviews-g294265-d17237163-r757312033-Jewel_Changi_Airport-Singapore.html
Jewel Changi Airport,Kaymtravel7,An airport like no other,50,27-May-20,"Singapore is truly a unique place, and this airport is no exception. It has the largest indoor waterfall, and it's very fun to get views of it from the four or five different levels, all the way at the base, to almost at the very top. It's very beautiful to walk around and take in the interesting scenery. There are tons of shops and places to eat in a very condensed place. We checked in early so we could have some time to wander around.",https://media-cdn.tripadvisor.com/media/photo-l/1a/f6/e2/81/default-avatar-2020-43.jpg,https://www.tripadvisor.com.sg/ShowUserReviews-g294265-d17237163-r755448366-Jewel_Changi_Airport-Singapore.html
Jewel Changi Airport,Aslam_Sherif,Beautiful Waterfall,50,15-May-20,This is really amazing never seen anything like this anywhere in the world. The view of the waterfall is breathtaking and very relaxing. You can go to different level and view the waterfall. You can get better view of waterfall on level 3. There are plenty seating areas to enjoy this waterfall. If you are in the airport this is a must visit.,https://media-cdn.tripadvisor.com/media/photo-l/14/7e/2d/65/aslam-sherif.jpg,https://www.tripadvisor.com.sg/ShowUserReviews-g294265-d17237163-r753517152-Jewel_Changi_Airport-Singapore.html
Jewel Changi Airport,WanderingWithUsTwo,Best place for a flight delay,50,13-May-20,We chose to have a long layover in Singapore (15hrs) to be able to explore it for a day. This adventure started at the airport which we could have stayed in for the entire 15 hours without getting bored. They have many unique free things to do and see while you wait in the airport including a butterfly garden! This particular airport has been rated top in the world for the past 6 years and has definitely earned that title. The Jewel is the latest in their attractions and now holds the world record for the largest indoor waterfall. Hidden near the arrival hall of terminal 1 this is worth stopping by. This end of the airport includes a high end shopping mall with many international stores which hide the waterfall while adding more mystique to the attraction. There are many levels of stairs and walkways surrounding the jewel to allow you to get different perspectives of it and the iconic selfie by it. While we were there they had signs displayed that mentioned new additions to the Jewel experience this year which include a canopy bridge. This entire area of the airport will be adding over 10 new attractions estimated by the end of this year (2019). We highly advise stopping by even for a small layover to at least witness the airport for yourself. Keep in mind if you have a layover for over 5 hours the airport also offers free tour bus rides of Singapore as well!- @wanderingwithustwo,https://media-cdn.tripadvisor.com/media/photo-l/1b/51/37/ec/wanderingwithustwo.jpg,https://www.tripadvisor.com.sg/ShowUserReviews-g294265-d17237163-r753471698-Jewel_Changi_Airport-Singapore.html
Jewel Changi Airport,DaGoh1312,Tons of things to do!,50,5-May-20,"Been there multiple times and I haven't yet step into every single shop! I've been to different restaurants every time I went there and their service and food are good! Airport has always been a good hang out place and ever since Jewel's arrival, it just made things much better and enjoyable!For families with kids, I suggest you guys to visit the Canopy Park at the top floor! They will have tons of fun there!",https://media-cdn.tripadvisor.com/media/photo-l/1a/f6/e9/ef/default-avatar-2020-66.jpg,https://www.tripadvisor.com.sg/ShowUserReviews-g294265-d17237163-r753143875-Jewel_Changi_Airport-Singapore.html
Jewel Changi Airport,TravelgalCathy,Nicest airport in the world!,50,3-May-20,"Had a 10- hour layover and after sleeping at the hotel at the airport, we checked out the Jewel, which opened in October 2019. It's lush, peaceful, and air-conditioned, but you feel like you are outside. Definitely worth spending some time to see it - I viewed a documentary about it on a Singapore Airlines flight - it is immaculate and they do a great job of keeping it in tip-top shape.",https://media-cdn.tripadvisor.com/media/photo-l/03/15/52/e0/travelgalcathy.jpg,https://www.tripadvisor.com.sg/ShowUserReviews-g294265-d17237163-r753096832-Jewel_Changi_Airport-Singapore.html
Jewel Changi Airport,zebragorda,Best airport in the world again,50,27-Apr-20,This is one amazing place located at the airport. The vortex and indoor forest and almost too real.. Nice glass Walkway to see the vortex.,https://media-cdn.tripadvisor.com/media/photo-l/06/d0/e0/ff/joseph-s.jpg,https://www.tripadvisor.com.sg/ShowUserReviews-g294265-d17237163-r752940547-Jewel_Changi_Airport-Singapore.html
Jewel Changi Airport,Bobafettea2486,refreshing and cooling place to hang around,50,25-Apr-20,"you can have a walk around and check out the waterfall area. it is beautiful and with all the floral, is like you walk into a forest.It has a lot of cafes and restaurant.Best of all, it has Pokemon Center!!!",https://media-cdn.tripadvisor.com/media/photo-l/1a/f6/e7/fe/default-avatar-2020-58.jpg,https://www.tripadvisor.com.sg/ShowUserReviews-g294265-d17237163-r752905191-Jewel_Changi_Airport-Singapore.html
Jewel Changi Airport,shresthanjann,Amazing waterfall,50,13-Apr-20,Best airport in the world with best amenities. The waterfall is amazing and also the flower garden and canopy bridge. Well connected from the main airport.,https://media-cdn.tripadvisor.com/media/photo-l/17/3d/33/09/shresthanjann.jpg,https://www.tripadvisor.com.sg/ShowUserReviews-g294265-d17237163-r752539475-Jewel_Changi_Airport-Singapore.html
Jewel Changi Airport,baghdadlian,Excellent Place,50,30-Mar-20,When we landed at Changi Airport they were screening for corona virus and asked a lot of questions. We were good to enter Singapore from Canada. This airport is so beautiful out of a story book. The Jewel is outstanding and we enjoyed it very very much.,https://media-cdn.tripadvisor.com/media/photo-l/1a/42/47/67/baghdadlian.jpg,https://www.tripadvisor.com.sg/ShowUserReviews-g294265-d17237163-r752002297-Jewel_Changi_Airport-Singapore.html
Jewel Changi Airport,snowplumeria,New Favourite Place in Singapore,50,27-Mar-20,The Rain Vortex is absolutely mesmerising. Make sure to catch the show if you are visiting in the evening! Each show lasts about 5 mins and runs from 8.30pm to 12.30am daily at hourly intervals. Hands down the best experience you can get at an airport!,https://media-cdn.tripadvisor.com/media/photo-l/1b/3d/8e/d1/caption.jpg,https://www.tripadvisor.com.sg/ShowUserReviews-g294265-d17237163-r751892030-Jewel_Changi_Airport-Singapore.html
Jewel Changi Airport,amarpuri90,Amazing,50,20-Mar-20,This is really amazing and worth the visit. Make sure you watch the light show in the evening at the indoor waterfall. It's really relaxing just sitting and watching the waterfall here during anytime of the day. I have visited a few times when returning to Singapore at Terminal 1. Changi airport has always been amazing but the Jewel took it to a new level. Would definitely recommend it.,https://media-cdn.tripadvisor.com/media/photo-l/17/f2/46/3d/amarpuri90.jpg,https://www.tripadvisor.com.sg/ShowUserReviews-g294265-d17237163-r751408342-Jewel_Changi_Airport-Singapore.html
Jewel Changi Airport,evyeo,Shopping heaven,50,20-Mar-20,"Jewel is the latest attraction in Changi Airport. It comprises of fashion shops, eateries and exclusive attractions such as mirror maze, canopy park, hedge maze etc. The main attraction of Jewel is the rain vortex! It is gorgeous!",https://media-cdn.tripadvisor.com/media/photo-l/1a/f6/e5/2b/default-avatar-2020-52.jpg,https://www.tripadvisor.com.sg/ShowUserReviews-g294265-d17237163-r751407299-Jewel_Changi_Airport-Singapore.html
Jewel Changi Airport,Alex-Koi-168,Gardens by the bay flower dome-Shopping mall version,50,18-Mar-20,"Basically this is a entry free version of the flower dome from Gardens by the bay.If you are flying out, make sure you do not go through customs. The Jewel is a public access mall. Problem is with the your bags. As trolleys are not allowed in the elevator(what are they thinking when they design this place). As a trade off, there is a baggage storage at ground level.Best light show happens after dark.",https://media-cdn.tripadvisor.com/media/photo-l/1b/2c/fe/63/avatar.jpg,https://www.tripadvisor.com.sg/ShowUserReviews-g294265-d17237163-r751268635-Jewel_Changi_Airport-Singapore.html
Jewel Changi Airport,986darshand,world's best,50,17-Mar-20,"if you are in Singapore and missed jewel changi then your trip is useless.jewel has so much to offer you for whole day.actually its a part of airport it self but you can't visit if you don't have visa for Singapore bcz you have to pass through immigration then you may go there by free airport bus.i planned my visit on first day only after i landed in Singapore. bcz my flight arrival was at morning 10.30 so i planned my first day till evening 7.00 there only. around 7pm there is free sound and light show at HSBC rain vortex don't miss it.basement to floor 5th so much to see, shopping, etc. and on 5th floor there are few activities you must try. buy its combo tickets from its website only. don't buy separate attractions on website.for me bouncing net and mirror maze was very exciting. you may jump as much you can on bouncing net. forget your age and just chill.",https://media-cdn.tripadvisor.com/media/photo-l/1a/f6/e4/2d/default-avatar-2020-48.jpg,https://www.tripadvisor.com.sg/ShowUserReviews-g294265-d17237163-r751111392-Jewel_Changi_Airport-Singapore.html
Jewel Changi Airport,kingofpeppange,amazing place,50,15-Mar-20,"Don't visit Singapore , or transit via Changi Airport without visiting 'The Jewel' ! The name is well deserved : Impressive construction , beautiful indoor waterfall surrounded by an indoor tropical garden , great shopping and restaurants within the structure...",https://media-cdn.tripadvisor.com/media/photo-l/1a/f6/e7/99/default-avatar-2020-57.jpg,https://www.tripadvisor.com.sg/ShowUserReviews-g294265-d17237163-r750929315-Jewel_Changi_Airport-Singapore.html
Jewel Changi Airport,Arlene S,Amazing!,50,15-Mar-20,This is an absolutely must see when you are in Singapore. Entrance is free but there are some charge options. We spent about 3 hours there and had a wonderful time,https://media-cdn.tripadvisor.com/media/photo-l/1a/f6/ee/10/default-avatar-2020-8.jpg,https://www.tripadvisor.com.sg/ShowUserReviews-g294265-d17237163-r750928646-Jewel_Changi_Airport-Singapore.html
Jewel Changi Airport,Tony P,A reflection of how amazing Singapore is,50,14-Mar-20,Staying in Crowne Plaza so exploring here was essential. It was slightly subdued because of the reduction in travellers.But the centre piece indoor waterfall is outstanding. Only in Singapore would you find such imaginative architecture. Watching the falls change colour as two trains perfectly synchronised passed each other behind them was awe inspiring,https://media-cdn.tripadvisor.com/media/photo-l/17/0f/c9/40/caption.jpg,https://www.tripadvisor.com.sg/ShowUserReviews-g294265-d17237163-r750814620-Jewel_Changi_Airport-Singapore.html
Jewel Changi Airport,merseyblue-1,Well worth a visit!,50,7-Mar-20,"Who would ever says they are impressed with airports? They basically serve a purpose. Some are good and some are not but Singapore Airport is a whole new level. The airport has to be one of the most organised and cleanest places we've travelled to. We stayed for one night at Crowne Plaza.The Jewel is land-side between terminals 2 and 3 and is very aptly named. It tends to be restaurants, coffee lounges and so on. There are several bars on the top level. There are some tourist attractions to visit and if you are passing through Singapore, I'd suggest you take time out to include this place. I would not say that about any other airport we've been through! Many airlines have a bag drop so you can get rid of your suitcase early and relax before you go air-side through security for your flight. Even air-side there is plenty to do and see.The world's biggest waterfall is impressive and in the evening from 7.30pm they do light shows with music.",https://media-cdn.tripadvisor.com/media/photo-l/18/86/0e/a3/merseyblue-1.jpg,https://www.tripadvisor.com.sg/ShowUserReviews-g294265-d17237163-r749637424-Jewel_Changi_Airport-Singapore.html
Jewel Changi Airport,ubphotography08,Amazing mall,50,7-Mar-20,Singapore is known for so many Malls! And this one is really amazing and worth the visit. Make sure you watch the light show in the evening at the tallest indoor waterfall.It's relaxing and peaceful just sitting and watching the waterfall here during anytime of the day. I have visited many times and will be keep going time to time,https://media-cdn.tripadvisor.com/media/photo-l/1a/f6/e7/99/default-avatar-2020-57.jpg,https://www.tripadvisor.com.sg/ShowUserReviews-g294265-d17237163-r749508572-Jewel_Changi_Airport-Singapore.html
Jewel Changi Airport,jonnyrocks,awesome,50,6-Mar-20,"We had a wait for conecting flight at the airport so jumped onto the conecting train and headed over to the Jewel. Fantastic experiance one I'm happy to have taken. The airport is amazing but the Jewel took it to a new level. Floor 5 is outstanding great restaurants, the water fall, the flower walk, just awesome. The shops were great but for me the whole place has to be an experiance not to be missed.",https://media-cdn.tripadvisor.com/media/photo-l/07/14/d6/14/jonnyrocks.jpg,https://www.tripadvisor.com.sg/ShowUserReviews-g294265-d17237163-r749448135-Jewel_Changi_Airport-Singapore.html
Jewel Changi Airport,dosrei,Amazing place!!,50,6-Mar-20,"We were amazed at the design of the place.So much thought has gone into the design. The shops are a shopaholics dream. There are many restaurants available including a Pizza Express where we enjoyed a lovely meal.The most amazing part for us was the waterfall and the planting and the gardens.The best bit was at 9.30pm when they have a light show on the fountain, just amazing. It has to be seen to be fully appreciated. So glad we came to see it and would definitely recommend it.",https://media-cdn.tripadvisor.com/media/photo-l/1a/f6/ef/32/default-avatar-2020-12.jpg,https://www.tripadvisor.com.sg/ShowUserReviews-g294265-d17237163-r749442945-Jewel_Changi_Airport-Singapore.html
