attractionName,reviewerName,reviewTitle,ratings,reviewDate,reviewText,reviewerProfilePicURL,reviewURL
Jewel Changi Airport,Ims92100,Worth the experience but please don't have people pay for access to the rain vortex!,40,4-Jan-20,"We are regular visitors of Jewel as this is a nice option to entertain before taking flights, especially at night. We really enjoy the canopy and our kids love to do the bouncing over there.The rain vortex is the main attraction, and remains always impressive to see.What a surprise to discover that for Christmas, the rain vortex was closed on L1 and L2 ! They ask you to get a receipt with 50 SGD spending to get a view of what has always been in free access until now... Even if you would abide by the rule, this is almost impossible as we use Jewel only a few hours before flying and don't have time to get to restaurant, get the right receipt, have it redeemed and then enter what should be a normal area of the mall. This is a very sad evolution of Jewel. Doesn't make good publicity to Shiseido to have their name associated to such a discrimative endeaviour. I understand we have to pay for canopy which is an attraction. I dont understand why we should be prevented to wander in a mall.",https://media-cdn.tripadvisor.com/media/photo-l/1a/f6/e4/a9/default-avatar-2020-50.jpg,https://www.tripadvisor.com.sg/ShowUserReviews-g294265-d17237163-r736656005-Jewel_Changi_Airport-Singapore.html
Jewel Changi Airport,Yvienahs,Retail service not up to standard,40,1-Jan-20,Jewel is a must go attraction if u are a tourist. The waterfall is magnificent. Sad to say that the retail shops and restaurant service in Jewel is not up to standard. It's jus a typical shopping mall.,https://media-cdn.tripadvisor.com/media/photo-l/11/c4/c5/0a/yvienahs.jpg,https://www.tripadvisor.com.sg/ShowUserReviews-g294265-d17237163-r735934652-Jewel_Changi_Airport-Singapore.html
Jewel Changi Airport,wuibin,Interesting & Unique,40,26-Dec-19,"Its not just another shopping mall. Its a place where you can visit attractions, experience and do different activities. There are lots of indoor greenery, with exotic plants to explore, activities that you can do (located on the 4th and 5th floors), have a meal with a view of an indoor waterfall, see a lights show (scheduled timings) etc. Do note that there are some activities which require covered footwear for safety. Can spend about 1/2 day to explore the place. Highly recommended!",https://media-cdn.tripadvisor.com/media/photo-l/1a/f6/ed/7b/default-avatar-2020-6.jpg,https://www.tripadvisor.com.sg/ShowUserReviews-g294265-d17237163-r734728564-Jewel_Changi_Airport-Singapore.html
Jewel Changi Airport,Pops541,Christmas/New Year Special Decorations,40,21-Dec-19,"Being a particularly wet day and having a few hours to kill, we decided on going to the ""Jewel at Changi Airport"".What an amazing dome! Absolutely huge from the outside and stunning inside with an abundance of shops and restaurants. Unfortunately most tended to be on the very expensive end of the scale but nevertheless well worth a visit to see the stunning decorations and displays. The cascading waterfall was quite breathtaking and as day gave way to nightfall and the many coloured lights reflected of the water, it became quite magical.Due to the very large crowd in attendance, photo opportunities were rather limited but that aside, well worth a visit.",https://media-cdn.tripadvisor.com/media/photo-l/1a/f6/e9/ef/default-avatar-2020-66.jpg,https://www.tripadvisor.com.sg/ShowUserReviews-g294265-d17237163-r733858416-Jewel_Changi_Airport-Singapore.html
Jewel Changi Airport,QldKaren,Transit has never been so much fun!,40,17-Dec-19,"Changi airport has so much to see and do. It's the perfect airport to while away the hours whilst transitting between flights.Our family of 4 had a 6 hour transit at Changi en route from Australia to London. We arrived into Changi's terminal 1 at about 630pm. We could have easily spent time wandering around the many shops in the airport terminal but instead we took our cabin bags with us, quickly and easily cleared immigration and walked directly from terminal 1 into the new adjoining Jewel complex. The Jewel is housed in a glass dome and is a massive retail shopping mall that also has a few attractions.The main attraction is the indoor garden and rain vortex. We visited in December and in order for 2 people to gain access to the ground level of the indoor garden we had to spend 50 SGD in the Jewel complex. There was no other way to enter. I am not sure if this was because the indoor garden was lit up for Christmas, or because there was a special Christmas dance show on, plus regular (very short) light shows, or whether spending money in the Jewel is the only way to gain access to the garden year round. In any event, it was great to see the rain vortex up close.We then made our way to level 5, which can only be accessed from lift foyers C and E. There are many bars and restaurants on this top floor of the complex, and it is also home to the canopy park and its attractions.The canopy park seemed to be endless and it was lovely to wander around it. There are a number of ticketed attractions inside the canopy park. My family enjoyed the canopy nets (there are walking and jumping options - we chose the walking nets because the jumping ones were booked out for the rest of the evening). There was also a hedge maze and a mirror maze, which we resolved to check out next time we transit through Singapore.Some things to note:- Children under the age of 13 were not permitted to go onto any of the canopy park attractions by themselves and had to be supervised by an adult (thus requiring an adult ticket to the attraction to be purchased in addition to the children's tickets). In our case, the other adult stayed with all the cabin bags!- Entry to any of the canopy park attractions includes entry to the canopy park itself. Given one of our adults was staying with the bags and not going on the canopy nets, we were able to purchase 'canopy park only admission'ù for 5 SGD for that person to allow them to enter the park.- Canopy park admission includes a small number of attractions - the foggy pools (perfect for toddlers), the topiary walk, petal garden and discovery slide.- The attractions closed at 10pm the night we were there.",https://media-cdn.tripadvisor.com/media/photo-l/1a/f6/f2/eb/default-avatar-2020-27.jpg,https://www.tripadvisor.com.sg/ShowUserReviews-g294265-d17237163-r733195548-Jewel_Changi_Airport-Singapore.html
Jewel Changi Airport,YapW,Beautiful,40,17-Dec-19,"The man made waterfall was beautiful ,it also has a very short light show at night.There were a lot of restaurants and stores to shop.Overall it was quite nice.It is great place to take pictures.",https://media-cdn.tripadvisor.com/media/photo-l/04/92/ff/ab/yap-w.jpg,https://www.tripadvisor.com.sg/ShowUserReviews-g294265-d17237163-r733131844-Jewel_Changi_Airport-Singapore.html
Jewel Changi Airport,TonyNguyen1102,Amazing,40,16-Dec-19,"I go from T4 by bus to T2, then walk to Jewel and it is worthy.Amazing water fall (with light show at night), big shopping mall and many things to do and eat.",https://media-cdn.tripadvisor.com/media/photo-l/1a/27/e3/bc/tonynguyen1102.jpg,https://www.tripadvisor.com.sg/ShowUserReviews-g294265-d17237163-r733004563-Jewel_Changi_Airport-Singapore.html
Jewel Changi Airport,JohnDoe33333,Wonderful waterfall,40,16-Dec-19,"A spectacular waterfall, which can be seen from within the Jewel or from the train transitting from Terminals 2 to 3. The train slows down as it passes by the waterfall. The place was very busy and looks like any other shopping mall in Singapore, except the waterfall. It is worth a visit.",https://media-cdn.tripadvisor.com/media/photo-l/1a/f6/e8/5b/default-avatar-2020-61.jpg,https://www.tripadvisor.com.sg/ShowUserReviews-g294265-d17237163-r732920255-Jewel_Changi_Airport-Singapore.html
Jewel Changi Airport,chentl63,Nice Place to kill time and dine,40,13-Dec-19,"Did a transit at Changi Airport on our way to Christchurch last month and the information counter staff gave us wrong information regarding Jewel. She told us that there is a Entrance Fee of S$50 to Jewel due to many visitors. We out off the idea visiting JewelOn my business trip to Singapore on 11/12, we ask the cleaner and he told us just walk till the end of the Terminal 3 Check-In Lobby(Right Hand side)! It took us the most 10 minutes walk and here we are!Very nice place. The ambiance is good. The man made colour waterfall is nicer than most waterfalls that I have seen.The waterfall is surrounded by a lot of restaurants.Good place to hang around if you arrive early at ChangiDisappointed on the wrong information provided by the Information Counter inside Changi Airport Terminal 2 & 3 or my family would have check out on this place during our transit to Christchurch recently",https://media-cdn.tripadvisor.com/media/photo-o/05/61/2b/51/chen-l.jpg,https://www.tripadvisor.com.sg/ShowUserReviews-g294265-d17237163-r732336516-Jewel_Changi_Airport-Singapore.html
Jewel Changi Airport,CorruptedSanity,Very very good,40,12-Dec-19,"But do keep in mind that you can only access it prior to going through passport controlThe center piece waterfall is beautiful but too too crowded.I wish they would do as Dubai mall and restrict the immediate area to paying customers. This way everyone is happy.There are a lot of restaurants, retail shops, souvenir shops and cafesIf you're flight is later in the afternoon and you have to check out, you can spend some time herePlz give this review a thumbs up",https://media-cdn.tripadvisor.com/media/photo-l/1a/4e/21/06/avatar.jpg,https://www.tripadvisor.com.sg/ShowUserReviews-g294265-d17237163-r732218374-Jewel_Changi_Airport-Singapore.html
Jewel Changi Airport,OzJohnno,Stunning Attraction,40,12-Dec-19,"This is something you should do on any Singapore stay, go see Singapore's newest attraction, Jewel. This great 8 storied domed attraction is a combination of a mall and indoor activities with this mammoth waterfall inside that flows from top to bottom. I have no idea how tall it is but I suppose it's all available if you ""Google it"".We wandered around for hours. Yes there is so much to see and it's well laid out plus it gave us the opportunity to have a ""Western"" lunch. To tell the truth I was craving a milk shake and when we stumbled upon a Shake Shack where we indulged in a Hot Dog, Hamburger, Fries and a Strawberry Shake. Just the type of meal you don't usually have in S.E Asia.The only negative I could think of about the Jewel is that there are many places to go or things to see that you have to pay for the privilege of taking part in. You guessed it. We didn't. That said it did not spoil a good day out.",https://media-cdn.tripadvisor.com/media/photo-f/01/4a/28/0d/ozjohnno.jpg,https://www.tripadvisor.com.sg/ShowUserReviews-g294265-d17237163-r732117550-Jewel_Changi_Airport-Singapore.html
Jewel Changi Airport,Ben T,Good from the outside,40,10-Dec-19,"We had just arrived from Australia and it said we had to spend $50 at participating stores to get into the Jewel for a Christmas light show. We couldn't figure out where we wanted to spend $50, and we had to store our luggage somewhere, and that would have cost us $40, so we decided to just watch it from the side.",https://media-cdn.tripadvisor.com/media/photo-l/17/51/89/a9/benno007123.jpg,https://www.tripadvisor.com.sg/ShowUserReviews-g294265-d17237163-r731802870-Jewel_Changi_Airport-Singapore.html
Jewel Changi Airport,Shinbei83,quite refreshing,40,10-Dec-19,we arrived at Terminal 2 Changi so we headed to Jewel by walking which is at Terminal 1. I guessed we were just want to look around and have fun while taking the refreshing mist from the water fall,https://media-cdn.tripadvisor.com/media/photo-l/1a/f6/ed/ce/default-avatar-2020-7.jpg,https://www.tripadvisor.com.sg/ShowUserReviews-g294265-d17237163-r731690393-Jewel_Changi_Airport-Singapore.html
Jewel Changi Airport,sashhimii,jewel,40,8-Dec-19,"i landed at changi T4 which i should be transferring by bus to T2 & Jewel (no worries, the bus available every 5 minutes), but on the busy period, you need to purchase minimum of SGD 50 at the airport to enter Jewel (they dont have any entrance fee).",https://media-cdn.tripadvisor.com/media/photo-l/1a/3c/db/24/clarinsafan.jpg,https://www.tripadvisor.com.sg/ShowUserReviews-g294265-d17237163-r731332535-Jewel_Changi_Airport-Singapore.html
Jewel Changi Airport,guiahm,Amazing Vortex,40,8-Dec-19,The view of the water vortex is really amazing! Transfers from different airport terminals is no fuss and a visit to this airport is truly worth it.,https://media-cdn.tripadvisor.com/media/photo-l/1a/f6/f0/d5/default-avatar-2020-17.jpg,https://www.tripadvisor.com.sg/ShowUserReviews-g294265-d17237163-r731295806-Jewel_Changi_Airport-Singapore.html
Jewel Changi Airport,AsianGM,Good sightseeing spot,40,6-Dec-19,The airport mall has become a destination in its own right!Noticed on our second visit though most people browse lots but spend little in the retail stores. Most are going for eats and viewing the huge waterfall. Good way to while away an hour or two.,https://media-cdn.tripadvisor.com/media/photo-l/02/1f/71/ca/asiangm.jpg,https://www.tripadvisor.com.sg/ShowUserReviews-g294265-d17237163-r730830819-Jewel_Changi_Airport-Singapore.html
Jewel Changi Airport,snelson0929,Beautiful Facility,40,3-Dec-19,"The waterfall and garden area is very nice, albeit very crowded. But in the end, it's yet another shopping mall. Definitely whoa look.",https://media-cdn.tripadvisor.com/media/photo-l/01/ab/81/c2/snelson0929.jpg,https://www.tripadvisor.com.sg/ShowUserReviews-g294265-d17237163-r730316145-Jewel_Changi_Airport-Singapore.html
Jewel Changi Airport,Suwatss,What's a nice new shopping mall,40,27-Nov-19,"This newly open mall, just open in Apr 2019, is a large convenient mall opposite to Changi airport Terminal 3. It has many interesting shops and restaurants but the most impressive thing here is the big waterfall with changing lights and the water flow down from the roof in such a magical way. Recommend",https://media-cdn.tripadvisor.com/media/photo-l/01/ab/7e/09/suwatss.jpg,https://www.tripadvisor.com.sg/ShowUserReviews-g294265-d17237163-r729043446-Jewel_Changi_Airport-Singapore.html
Jewel Changi Airport,Miler15,the vortex rain,40,24-Nov-19,It is truly a picture perfect masterpiece. it is accessible in all terminals. nice dome with plants and malls inside. a must see when in Singapore.,https://media-cdn.tripadvisor.com/media/photo-l/08/0b/a5/52/miler15.jpg,https://www.tripadvisor.com.sg/ShowUserReviews-g294265-d17237163-r728580766-Jewel_Changi_Airport-Singapore.html
Jewel Changi Airport,Mellieboo,Nice visit for an airport,40,24-Nov-19,"very nice to visit such a unique place, especially for an airport but Singapore Changi definitely does not disappoint. One of my favourite airport in the world. Can get very crowded so beware of the crowds. Restaurant selection is ok only and the popular ones usually have a very long queue. Go early or make reservation",https://media-cdn.tripadvisor.com/media/photo-l/06/5b/1d/27/mellieboo.jpg,https://www.tripadvisor.com.sg/ShowUserReviews-g294265-d17237163-r728524552-Jewel_Changi_Airport-Singapore.html
Jewel Changi Airport,kaiweiy2016,"Pretty crowded, felt kinda humid though",40,23-Nov-19,"Visited Jewel Changi when it was recently opened so it's still pretty crowded.A good variety of restaurants, the famous water feature and the netting walk at the top level.It felt a bit warm & humid during the afternoon when I was there, probably because of the water feature and the fact you can't air condition the place properly in such a big open space.But it's still worth at least one visit.",https://media-cdn.tripadvisor.com/media/photo-l/1a/f6/e4/59/default-avatar-2020-49.jpg,https://www.tripadvisor.com.sg/ShowUserReviews-g294265-d17237163-r728382378-Jewel_Changi_Airport-Singapore.html
Jewel Changi Airport,TAGT2010,Shopping mall right beside terminal 1,40,14-Nov-19,"Very convenient to come to this place by MRT. Specially if your flight is at midnight, it is good to come early and go around this place. They even have a movie house. Good for relaxing.",https://media-cdn.tripadvisor.com/media/photo-l/01/e6/30/f3/tagt2010.jpg,https://www.tripadvisor.com.sg/ShowUserReviews-g294265-d17237163-r726235122-Jewel_Changi_Airport-Singapore.html
Jewel Changi Airport,jmanthetravelman,Great to walk around and explore....,40,7-Nov-19,but beware that to get the closest and best views you'll need to buy a ticket. Otherwise a beautiful and amazing waterfall in the middle of the mall next to the Changi Airport.,https://media-cdn.tripadvisor.com/media/photo-l/18/0a/19/cb/jmanthetravelman.jpg,https://www.tripadvisor.com.sg/ShowUserReviews-g294265-d17237163-r724608177-Jewel_Changi_Airport-Singapore.html
Jewel Changi Airport,Ambar_Amit,An Average Attraction,30,31-May-20,"We were there because we had some spare days in SGP. It will take an hour to reach here from anywhere in the city. There is not much to do in form of activities. You can take a stroll or stay near the rain vortex. The paid attractions are quite unimaginative. Its better to just stroll for a while, eat/drink something and just take a bus ride back.",https://media-cdn.tripadvisor.com/media/photo-l/0e/29/73/a7/madhu-ambar.jpg,https://www.tripadvisor.com.sg/ShowUserReviews-g294265-d17237163-r755688829-Jewel_Changi_Airport-Singapore.html
Jewel Changi Airport,lesleyh330,Disappointing,30,26-Feb-20,"Well got here about five hours early for our flight ; but didn't bother me as I was under the impression there was lots to do at the airport . There isn't ; there are plenty of places to grab something to eat and some duty free and other shops , but I think they were all rather expensive . Went to butterfly garden and it was smaller than I thought it would be and I didn't see one butterfly ; might of had something to do with the fact that it was nighttime ; but if that's the case they should put a sign up to let people know ; do butterflies sleep at night ,I don't know and obviously neither did all the other people that were in there expecting to see butterflies",https://media-cdn.tripadvisor.com/media/photo-l/1a/f6/e5/66/default-avatar-2020-53.jpg,https://www.tripadvisor.com.sg/ShowUserReviews-g294265-d17237163-r747619052-Jewel_Changi_Airport-Singapore.html
Jewel Changi Airport,775teom,Ayam buah keluah was too sour & spicy to be swallowed.,30,23-Feb-20,"My husband & myself loved peranakan food. We were at the Jewel, Violet Oon's restaurant for dinner last night . We ordered the mango salad, Ngoh Hiang, udang bakar with sambal & Ayam buah keluah. All the dishes was delicious except for the Ayam buah keluah. It was so sour. When the dish arrived it looks so good that both of us scoop a big spoon full of the gravy onto our rice and mixed it. Thereafter,our plate of rice became extremely sour & spicy that every spoon full of it into our mouth was so difficult to swallow. In order not to waste food we tried very hard to finish the ayam(chicken). It was not the original peranakan taste.Sad and sorry to say that the dish was horrible. Feedback to the waiter , was told that Asam and chilies were added. The dish was eventually waive off on our bill. We left the restaurant with a sour face.",https://media-cdn.tripadvisor.com/media/photo-l/1a/f6/f2/7a/default-avatar-2020-25.jpg,https://www.tripadvisor.com.sg/ShowUserReviews-g294265-d17237163-r746815180-Jewel_Changi_Airport-Singapore.html
Jewel Changi Airport,rahul m,Never expected to find this at an airport,30,22-Feb-20,"First things first, we walked a lot, I mean a lot. So be prepared if you want to go to see the amazing waterfall. It was a good experience as we had some no of hours for our flight. We did not go anywhere else to be honest, just roamed around the waterfall, with all the greenery.",https://media-cdn.tripadvisor.com/media/photo-l/02/b7/22/9c/rahulmk.jpg,https://www.tripadvisor.com.sg/ShowUserReviews-g294265-d17237163-r746684755-Jewel_Changi_Airport-Singapore.html
Jewel Changi Airport,masbackpackers,"AMAZING INDOOR WATERFALL, BUT...",30,9-Feb-20,"i end up at Jewel Changi Airport after i'm finish up my assignn't at other place in singapore....suprisingly, Jewel really easy to found from mrt station at terminal 3 coz of large and clear signboard...after a long walk( about 15 min ), finally indoor waterfall caught my eyes with spectacular view...really nice and feel calm with indoor tree, cleanliness and sound of waterfall....but...as a muslim, there have several thing maybe need to be improve, such as food and praying place...to me, no suitable food court or shop can i buy food. Same situation with praying place. there's no praying place and halal food in Jewel...maybe, in departure hall at terminal 1 have halal food and praying place, but that terminal 1 really far...maybe Changi airport management can improve the facilities for muslims in the future...",https://media-cdn.tripadvisor.com/media/photo-l/1a/f6/ee/68/default-avatar-2020-9.jpg,https://www.tripadvisor.com.sg/ShowUserReviews-g294265-d17237163-r743858753-Jewel_Changi_Airport-Singapore.html
Jewel Changi Airport,Fred T,Parts shutdown for yearly maintenance; many places to eat and shop,30,20-Jan-20,"We had some time to kill before our late flight. Saw a movie in the basement. Got food from the ""hawker stalls"". But, the waterfall (at least) was shutdown for 8 days for yearly maintenance; so missed the part I wanted to see. Not sure if the hikes were open.",https://media-cdn.tripadvisor.com/media/photo-l/1a/f6/ee/10/default-avatar-2020-8.jpg,https://www.tripadvisor.com.sg/ShowUserReviews-g294265-d17237163-r740166921-Jewel_Changi_Airport-Singapore.html
Jewel Changi Airport,Ivan8883,Not impressed after reading so much about this space!,30,7-Jan-20,"Read a lot about this water feature and the shopping areas but when I finally visited, I must say I am disappointed.Singapore had a similar water feature at the Suntec city previously and this just seems to be a relocated unit! Sound system is so bad and smells of bad chemicals when near it. 5 minutes was all I can handle.",https://media-cdn.tripadvisor.com/media/photo-l/0f/ee/06/47/ivan8883.jpg,https://www.tripadvisor.com.sg/ShowUserReviews-g294265-d17237163-r737425100-Jewel_Changi_Airport-Singapore.html
Jewel Changi Airport,neuymil,Iconic Location,30,26-Dec-19,"The new airport is really beautiful with indoor waterfalls and plants and there are lots of newly opened shops and restaurants. However, it is rather crowded due to the influx of travelers hence might have to queue for some restaurants. Recommended to visit if you're stopping in Singapore for a short while before your next flight!",https://media-cdn.tripadvisor.com/media/photo-l/1a/66/17/d1/neuymil.jpg,https://www.tripadvisor.com.sg/ShowUserReviews-g294265-d17237163-r734711283-Jewel_Changi_Airport-Singapore.html
Jewel Changi Airport,Mable K,A misleading location,30,26-Dec-19,"Per most guide books, sounds like this place is very near to T2. However, this is misleading! It involves quite some walk from T2, though connected with a bridge. Today with a flight delay, thus spare enough time to visit this place.If you plan to take a quick look before departing, pls reserve more time to do so. It is actually a big shopping mall, nothing relates to Changi Airport.Also, most international airlines are located at T4. You can only reach T2 via free shuttle, which takes another 15 mins.The fountain is the only attraction, and have to pay various fees to go inside.",https://media-cdn.tripadvisor.com/media/photo-l/1a/f6/e4/59/default-avatar-2020-49.jpg,https://www.tripadvisor.com.sg/ShowUserReviews-g294265-d17237163-r734670773-Jewel_Changi_Airport-Singapore.html
Jewel Changi Airport,321juliust,Prefer mbs then jewel,30,25-Dec-19,"The lighting show was good, but long waiting ended in 3 minutes. Considering traveling all the way from tao payoh to Changi just for 3 minute show just not worth it. To me, mbs still the best compare to jewel and Sentosa.However no doubt, the food here is nice.",https://media-cdn.tripadvisor.com/media/photo-l/1a/2b/1e/e9/avatar.jpg,https://www.tripadvisor.com.sg/ShowUserReviews-g294265-d17237163-r734563378-Jewel_Changi_Airport-Singapore.html
Jewel Changi Airport,BT993TT,Another big shopping mall ......,30,14-Dec-19,"Managed to pay a visit to Jewel following an inbound flight arrival at Terminal 1. A new, nice and big shopping mall! Just not my thing so ..... Visited and tried their food hall (food court) in Basement 2 called Five Spices. There is a good variety of stalls and we tried 3 of them. They are Saravanaa Bhavan ($7.50), Nasi Ayam Taman Serasi ($5.50) and Guan's Mee Pok ($6.50). Of course prices are dependent on what you order. You can refer to my photos. All served decent quality food but as expected, it is rather pricey and not a lot of food ..... understandably so given the venue location. It is not a very large food hall so the number of tables are somewhat limited. I would recommend that you transit over to the food hall in the Basement of Terminal 3. Much better if you are looking for a more ""local"" feel and larger variety and more places to sit. But if you are looking to kill time and to window shop or shop then this is it at the airport.",https://media-cdn.tripadvisor.com/media/photo-l/1a/f6/f2/7a/default-avatar-2020-25.jpg,https://www.tripadvisor.com.sg/ShowUserReviews-g294265-d17237163-r732508036-Jewel_Changi_Airport-Singapore.html
