attractionName,reviewerName,reviewTitle,ratings,reviewDate,reviewText,reviewerProfilePicURL,reviewURL
Jewel Changi Airport,robert3cathome,Stunning & Unbelievable,50,6-Mar-20,We had a chance to fly through the Singapore Changi airport. The Jewel at Terminal 1 is something that cannot be missed. The waterfall is a sight to behold. Take the escalators to the top floor and there are bars and restaurants overlooking the waterfall and gardens. At each level in between are more restaurants and shopping. You will think you are in a high-end mall and not an airport terminal. The Jewel has to be seen to be believed!,https://media-cdn.tripadvisor.com/media/photo-s/01/2e/70/a6/avatar077.jpg,https://www.tripadvisor.com.sg/ShowUserReviews-g294265-d17237163-r749244244-Jewel_Changi_Airport-Singapore.html
Jewel Changi Airport,billyloh,An ideal place to carry out wedding proposal,50,4-Mar-20,"Jewel Changi Airport will definitely be an ideal location to carry out wedding proposal. Although it is a nerve-wrecking experience to carry out wedding proposal in a crowded place, there is no worry of rain or shine as it is an indoor environment. With just simple preparation, coupled with the setting - she worn the diamond on 20th May 2019 at 1314hr.",https://media-cdn.tripadvisor.com/media/photo-l/0e/ff/7d/a7/billy-l.jpg,https://www.tripadvisor.com.sg/ShowUserReviews-g294265-d17237163-r748947584-Jewel_Changi_Airport-Singapore.html
Jewel Changi Airport,irishspringggg,Jewel changi ‚ù§Ô∏è,50,3-Mar-20,The airport itself is a tourist attraction. It's super modern and at the same time close to nature feels. Waiting for a long flight scheduled? Jewel got your back!,https://media-cdn.tripadvisor.com/media/photo-l/1a/f6/e8/91/default-avatar-2020-62.jpg,https://www.tripadvisor.com.sg/ShowUserReviews-g294265-d17237163-r748778316-Jewel_Changi_Airport-Singapore.html
Jewel Changi Airport,jutatip49,"Jewel, a must- see tourist attraction at Changi airport!",50,3-Mar-20,"We really enjoy our quality hours at Jewel shopping mall Changi airport, not only for shopping and eating, but also for exploring an amazing Neo- futurism architectural style. This iconic building is designed by the world- renowned architect Moshe Safdie, (a 81 years old, Israeli-born who is behind iconic Marina Bay Sands resort). It is opened in April 2019 to welcome 300,000 visitors per day, so far we heard that over 50 millions have visited it. The highlight of Jewel atrium is the largest indoor water fall - 40 meters high rain vertex and 5 storey-forest-valley with walking trails. This iconic spot is highly recommended especially at night time you will be able to marvel the colorful light show.",https://media-cdn.tripadvisor.com/media/photo-l/1a/f6/ec/3d/default-avatar-2020-1.jpg,https://www.tripadvisor.com.sg/ShowUserReviews-g294265-d17237163-r748712037-Jewel_Changi_Airport-Singapore.html
Jewel Changi Airport,Catallena,A Real Jewel,50,2-Mar-20,"Nestled at the heart of Changi Airport is this work of art that even Picasso can't even believe. Name better way to welcome a tourist coming from overseas to Singapore. I bet you can't. Jewel is indeed Singapore's Jewel alongside with the famous Gardens by the Bay. Such an eyecandy. And to all the tourist travelling SG, please, do yourself a favor, before going to your homestay or hotel, walk an extra meter to see this work of art.",https://media-cdn.tripadvisor.com/media/photo-l/17/09/b1/43/caption.jpg,https://www.tripadvisor.com.sg/ShowUserReviews-g294265-d17237163-r748527860-Jewel_Changi_Airport-Singapore.html
Jewel Changi Airport,vaibhav_maheshwari56,Family trip to Singapore,50,29-Feb-20,Nice place for shopping and in built magnificent waterfall is awesome to view and overall a nice experience,https://media-cdn.tripadvisor.com/media/photo-l/1a/f6/ec/a2/default-avatar-2020-3.jpg,https://www.tripadvisor.com.sg/ShowUserReviews-g294265-d17237163-r748281323-Jewel_Changi_Airport-Singapore.html
Jewel Changi Airport,TraceyR1584,Great addition to Changi,50,29-Feb-20,"The best place to waste time whilst waiting to catch your flight. Magnificent architecture and gardens around waterfall. Shopping, food courts etc- entertainment- it's a great way to kill a few hours.",https://media-cdn.tripadvisor.com/media/photo-l/1a/f6/eb/43/default-avatar-2020-11.jpg,https://www.tripadvisor.com.sg/ShowUserReviews-g294265-d17237163-r748256318-Jewel_Changi_Airport-Singapore.html
Jewel Changi Airport,Keith_Lynn01,Amazing,50,28-Feb-20,Wow what can I say.... This gem will knock sports of most attractions and certainly any global airport.If you are not flying from T1 and can get to the airport a little earlier then get yourself over to 'The Jewel'ù around 10min walk from T3. I promise you this you will not be disappointed.A must see Ô∏è,https://media-cdn.tripadvisor.com/media/photo-a/03/01/1f/99/keith-lynn01.jpg,https://www.tripadvisor.com.sg/ShowUserReviews-g294265-d17237163-r748102244-Jewel_Changi_Airport-Singapore.html
Jewel Changi Airport,Ellie1145,Astonishing,50,28-Feb-20,"We flew from Changi to Sydney and were eager to visit the recently opened Jewel.We checked in for our flight then followed the signs, which are clearly displayed, to this amazing feature.It was very crowded, and we didn't want to miss our flight so we weren't able to spend as long as we would have liked, but it certainly takes your breath away. The lifts were very slow and jam packed so that made it harder to see everything. I gave up and walked down instead.This wonderful attraction is linked to three of its passenger terminals, and was quite a walk for us from check in.Built in a huge glass dome, the centrepiece is the astonishing Rain Vortex, the tallest indoor waterfall in the world. It's surrounded by lush vegetation and terraces where you can sit and gaze at it in all its glory.The site covers over 8 acres and has 12 storeys, 7 of which are at basement level.The glass and steel facade was actually designed by the same architects who designed the Marina Bay Sands Hotel, with its iconic ship perched on the top of the building.The Shiseido Forest Valley is one of Asia's largest indoor gardens. It covers around 22,000 square metres and spans 5 stories. It's extraordinary to think that there are around 3,000 trees and 60,000 shrubs from all around the world.But it's piece de resistance has to be the astonishing Rain Vortex waterfall which dominates the centre of the garden, and stands 130 ft high. It cascades down from a round hole in the glass ceiling and an incredible 38,000 litres of recirculating rain water is pumped through the hole every minute. Below it is a huge basement level pool.The glass roof, which is toroid shaped, is made up of over 9,000 pieces of glass. At night it becomes the 360 degree backdrop for a light and sound show, which sadly we could not stay for.It's a truly astonishing piece of engineering and design, and it is incredible to think that it is inside an airport.We just didn't have time to visit the canopy park, which is about $5 to enter, or the canopy mazes, but I was able to walk down to the bottom of the waterfall and stand and gaze in awe at its beauty.It seems odd to want to spend more time in an airport, but there is still so much to see here in Jewel that I hope one day to return.",https://media-cdn.tripadvisor.com/media/photo-l/19/5e/9f/71/ellie1145.jpg,https://www.tripadvisor.com.sg/ShowUserReviews-g294265-d17237163-r748010882-Jewel_Changi_Airport-Singapore.html
Jewel Changi Airport,Debra P,Crazy Fantastic! MUST SEE!,50,28-Feb-20,"I didn't believe that an airport could actually be a destination, but this one is. If you are visiting Singapore, or have a layover, you MUST spend time in this airport. Best if you can visit ""The Jewel"" at night, but beautiful any time. The entire airport is worth exploring.",https://media-cdn.tripadvisor.com/media/photo-o/07/ed/6c/8d/debra-p.jpg,https://www.tripadvisor.com.sg/ShowUserReviews-g294265-d17237163-r748001767-Jewel_Changi_Airport-Singapore.html
Jewel Changi Airport,japa123,very impersive design,50,28-Feb-20,"wide range of food selection, food is nice and lots of seat inside teh resturant, impressive design and you will not know is this an airport.",https://media-cdn.tripadvisor.com/media/photo-l/1b/03/cf/2a/japa123.jpg,https://www.tripadvisor.com.sg/ShowUserReviews-g294265-d17237163-r747947676-Jewel_Changi_Airport-Singapore.html
Jewel Changi Airport,Chimptrips,Best airport ever,50,27-Feb-20,"It's no surprise that this has been voted the best airport in the world 7 times. The indoor waterfall is spectacular - even better when the light shows are on. There are lots of things to do, though you do have to pay for some of them. There are plenty of eateries, but allow time if you are travelling at the weekend.",https://media-cdn.tripadvisor.com/media/photo-l/1a/d2/92/c4/chimptrips.jpg,https://www.tripadvisor.com.sg/ShowUserReviews-g294265-d17237163-r747897698-Jewel_Changi_Airport-Singapore.html
Jewel Changi Airport,O6854KIricks,Cooling peaceful at off peak period.,40,1-Jan-21,"The team is friendly and courteous, the pokemon explorer unable to detect the blue tooth signal and some is not available. Long queue in eatery.Apart from that, it is a nice day at jewel. Beautiful environment and excellent toilet cleanliness and hygenie",https://media-cdn.tripadvisor.com/media/photo-l/1a/f6/f0/9f/default-avatar-2020-16.jpg,https://www.tripadvisor.com.sg/ShowUserReviews-g294265-d17237163-r780322715-Jewel_Changi_Airport-Singapore.html
Jewel Changi Airport,KGB777,Return to Jewel,40,22-Dec-20,"Returned to Jewel for another visit last month, there not being so many things to do on a rainy day in Singapore. Unfortunately it was very busy and there were long queues for most of the activities. Still impressive to see the indoor waterfall though.",https://media-cdn.tripadvisor.com/media/photo-l/05/35/2d/07/kgb777.jpg,https://www.tripadvisor.com.sg/ShowUserReviews-g294265-d17237163-r779751488-Jewel_Changi_Airport-Singapore.html
Jewel Changi Airport,KarenHosehbo,Yummy ü§§,40,18-Dec-20,Awesome foodSlow serviceThe food came before we got our cutleries and I had to ask the servers twice before we could get them. First one I asked was new I think? As he was not wearing the prive uniform but overall great experience,https://media-cdn.tripadvisor.com/media/photo-l/1a/f6/de/e7/default-avatar-2020-37.jpg,https://www.tripadvisor.com.sg/ShowUserReviews-g294265-d17237163-r779449954-Jewel_Changi_Airport-Singapore.html
Jewel Changi Airport,Kkkl2012,A fun day at jewel,40,8-Nov-20,Short waiting time. Fun and new activities. Some children door gifts will be nice. Theme according to festival. More small animals like rabbits or hamsters (trained ones),https://media-cdn.tripadvisor.com/media/photo-l/1a/f6/77/ae/default-avatar-2020-2.jpg,https://www.tripadvisor.com.sg/ShowUserReviews-g294265-d17237163-r776726535-Jewel_Changi_Airport-Singapore.html
Jewel Changi Airport,kim buay p,Dining in a green space,40,28-Oct-20,"After visiting the Jurassic Mile, it was a lovely walk in fine weather along the Changi Airport Connector to Terminal 2 along well-landscaped path (2 km). It was a novel way for me to reach the Jewel via the elevated Linkbridge from Terminal 2. Under normal circumstances, I rely on the skytrain to hop between terminals. The view along the Linkbridge was pretty with view of the Control Tower and the Jewel. We ate our lunch here. The shops and restaurants are opened and it has a lively atmosphere. Great place to dine and stroll.",https://media-cdn.tripadvisor.com/media/photo-l/18/09/5a/5c/kim025singapore.jpg,https://www.tripadvisor.com.sg/ShowUserReviews-g294265-d17237163-r775794342-Jewel_Changi_Airport-Singapore.html
Jewel Changi Airport,londonwatford,great architecture,40,21-Apr-20,"The centrepiece of the Jewel is the waterfall that falls from the ceiling of the dome. Officially known as the Rain Vortex, at 40 metres high it's the world's tallest indoor waterfall. You can see this from all the angles and beautifully lit at night when the colour changes",https://media-cdn.tripadvisor.com/media/photo-l/1a/f6/e4/a9/default-avatar-2020-50.jpg,https://www.tripadvisor.com.sg/ShowUserReviews-g294265-d17237163-r752793885-Jewel_Changi_Airport-Singapore.html
Jewel Changi Airport,feltroneu,Huge artificial waterfall,40,7-Apr-20,It is a new shopping in Changi airport. Obviously the most attractive object in this mall is the artificial waterfall which is right in the middle of the mall. I liked the design which give a sense of the forest feel. There is no observation deck but you view it from different floors. The mall offered variety of branded goods. It is an expensive place for shopping at least I enjoyed the windows shopping the free air-cond as the climate in Singapore was really hot during the time I visited.,https://media-cdn.tripadvisor.com/media/photo-l/1b/3b/4e/b6/feltroneu.jpg,https://www.tripadvisor.com.sg/ShowUserReviews-g294265-d17237163-r752351200-Jewel_Changi_Airport-Singapore.html
Jewel Changi Airport,Ronald L,Worth Visiting,40,27-Mar-20,"We went to see JEWEL at Terminal 1 on our way out of Singapore. Must see when inSingapore. Multilevel greenery in Terminal 1 with a tremendous waterfall, 40 meters tall, in the center, dropping from the ceiling and disappearing into the floor, on level 1. Your view of this amazing waterfall changes with the level you are viewing from. There is greenery throughout this immaculately clean airport.",https://media-cdn.tripadvisor.com/media/photo-s/01/2e/70/95/avatar021.jpg,https://www.tripadvisor.com.sg/ShowUserReviews-g294265-d17237163-r751865059-Jewel_Changi_Airport-Singapore.html
Jewel Changi Airport,teror534,early checkin,40,25-Mar-20,"A great place to spend time in transit. Early checkin for several airlines saved the day, and allowed us to look around more freely.",https://media-cdn.tripadvisor.com/media/photo-l/1a/f6/f6/0d/default-avatar-2020-34.jpg,https://www.tripadvisor.com.sg/ShowUserReviews-g294265-d17237163-r751746153-Jewel_Changi_Airport-Singapore.html
Jewel Changi Airport,Lifeishardbutholiday,Great place to visit.,40,21-Mar-20,"We spent a day here (including having lunch in the middle), the waterfall was a beautiful sight. We bought a package to enter the canopy park and do all the attractions. Loved the Mirror maze, the mist bridge and the bouncy nets. The net walk was harder and scarier than we expected, little feet go through the net. See the waterfall from all the different levels using the elevator. Kids loved this place (aged 6 and 9)",https://media-cdn.tripadvisor.com/media/photo-l/1a/f6/ed/ce/default-avatar-2020-7.jpg,https://www.tripadvisor.com.sg/ShowUserReviews-g294265-d17237163-r751526267-Jewel_Changi_Airport-Singapore.html
Jewel Changi Airport,Coastchelle,Very quiet after 10pm. Wheelchair friendly.,40,16-Mar-20,"We had a 2am flight so arrived with plenty of time to explore the Jewel. Wasn't aware everything closes early. The light show on the waterfall was still on and amazing. Wheelchair friendly mostly everywhere. Sorry we missed it during open hours. Found it difficult to find somewhere to eat. Was a weekend so perhaps could look at later closing hours. Accessibility amenities available. And lifts, just spread out.",https://media-cdn.tripadvisor.com/media/photo-l/1b/2a/90/b3/coastchelle.jpg,https://www.tripadvisor.com.sg/ShowUserReviews-g294265-d17237163-r751032883-Jewel_Changi_Airport-Singapore.html
Jewel Changi Airport,843natw,A Jewel in the Airport,40,2-Mar-20,The Jewel at Changi Airport is a delightful step away from the traditional airport building. The combination of an amazing attraction with many retail and restaurant options in an airport location is alluring to both tourists as well as locals.,https://media-cdn.tripadvisor.com/media/photo-s/01/2e/70/60/avatar038.jpg,https://www.tripadvisor.com.sg/ShowUserReviews-g294265-d17237163-r748626848-Jewel_Changi_Airport-Singapore.html
Jewel Changi Airport,SurajN173,A quick detour before you fly,40,26-Feb-20,If you have about 20 minutes to spare then head down to the magnificent Jewel terminal which has a stunning waterfall and a lot of indoor greenery. We walked to it from inside the departure terminal before checking in for our flight.,https://media-cdn.tripadvisor.com/media/photo-l/1a/f6/f3/7c/default-avatar-2020-29.jpg,https://www.tripadvisor.com.sg/ShowUserReviews-g294265-d17237163-r747727421-Jewel_Changi_Airport-Singapore.html
Jewel Changi Airport,occasional_typo,yeh there's a waterfall at an airport...,40,23-Feb-20,Never in my dreams would I expect to see a waterfall in an airport - but there it is.We were early for our flight and we'd read about the Jewel opening in 2019 so decided to go and eat plus sightsee.The planted forest and waterfall area is truly breathtaking. We were lucky as there were fewer visitors due to virus fears as I can imagine it gets very crowded in the centre.The rest of the mall is 10 floors of shopping and eating. You can also check in and store bags if you want to walk around unencumbered,https://media-cdn.tripadvisor.com/media/photo-l/0b/bd/c7/d8/gabbymalpas.jpg,https://www.tripadvisor.com.sg/ShowUserReviews-g294265-d17237163-r746775780-Jewel_Changi_Airport-Singapore.html
Jewel Changi Airport,Natalia T,Lovely plants and greenery,40,18-Feb-20,"This is the latest addition to Changi Airport. It's huge with lots of shops and restaurants, as well as activities such as the Canopy Walk, maze etc. The trees and greenery really make it lovely. There are also flight check in counters here, where you can do an early check in, and then relax and wander around the place.",https://media-cdn.tripadvisor.com/media/photo-l/0e/1c/f4/d1/nataliatan2014.jpg,https://www.tripadvisor.com.sg/ShowUserReviews-g294265-d17237163-r745852705-Jewel_Changi_Airport-Singapore.html
Jewel Changi Airport,Vivasummer,Take your breath away,40,15-Feb-20,"Passed by many times and the rain of the sight of the rain vortex had never failed to arrest me. A few moment to admire the scene (definitely) then quick snaps of photos (if short of time) or a rest in the ""forest"" to watch the water flowing down. The place was always crowded with local and tourist alike but I could feel myself relax down. Kid really enjoyed it. An oasis right amidst the hustle bustle. If you transit or arrive in Singapore, recommend to come and admire this architect marvel.",https://media-cdn.tripadvisor.com/media/photo-l/1a/e3/03/1e/vivasummer.jpg,https://www.tripadvisor.com.sg/ShowUserReviews-g294265-d17237163-r745121558-Jewel_Changi_Airport-Singapore.html
Jewel Changi Airport,yps0909,A jewel in an airport.,40,12-Feb-20,A brilliant design and architecture.a jewel in an airport indeed.a great place to spend time in waiting your flight.,https://media-cdn.tripadvisor.com/media/photo-l/1a/f6/df/2b/default-avatar-2020-39.jpg,https://www.tripadvisor.com.sg/ShowUserReviews-g294265-d17237163-r744558320-Jewel_Changi_Airport-Singapore.html
Jewel Changi Airport,Ingeborg56,Fantastic waterfall!,40,10-Feb-20,"We came there only for the waterfall and the green sourroundings, but we observed that there were quite a few restaurants, cinema etc. in addition to the waterfall.Very nice waterfall, and a great building.",https://media-cdn.tripadvisor.com/media/photo-l/1a/f6/e7/3d/default-avatar-2020-55.jpg,https://www.tripadvisor.com.sg/ShowUserReviews-g294265-d17237163-r744110438-Jewel_Changi_Airport-Singapore.html
Jewel Changi Airport,julian c,View from a train,40,8-Feb-20,We thought we would visit the Jewel whilst we were waiting for our flight so we asked at the information desk how to get to it. The lady was very helpful but told us we would really need five hours to visit because you need to go back through immigration and need plenty of time to walk around it. Unfortunately we did not have the time but she recomended taking the Skytrain between terminals 2 and 3 which passes right through the Jewel and slows down as you pass through. We made a trip there and back on the Skytrain so was able to marvel at the plantings and that spectacular waterfall. Would factor in extra time to your travel arrangements if you can. It's pretty awesome.,https://media-cdn.tripadvisor.com/media/photo-l/15/52/cd/97/julian-c.jpg,https://www.tripadvisor.com.sg/ShowUserReviews-g294265-d17237163-r743704616-Jewel_Changi_Airport-Singapore.html
Jewel Changi Airport,badmintontim,A Great 'Jewel' of the airport,40,5-Feb-20,This is a large part of the airport which is big enough in itself and gives it a really modern feel to it with an architecture of its own,https://media-cdn.tripadvisor.com/media/photo-l/07/da/6a/8c/badmintontim.jpg,https://www.tripadvisor.com.sg/ShowUserReviews-g294265-d17237163-r743174373-Jewel_Changi_Airport-Singapore.html
Jewel Changi Airport,Elaine K,Amazing man made waterfall,40,25-Jan-20,"This man made structure is amazing. Located by the Airport and mall, it strategically showcases and introduces the waterfall admist shopping and eating outlets. Very popular with locals and tourists.",https://media-cdn.tripadvisor.com/media/photo-l/1a/f6/e8/91/default-avatar-2020-62.jpg,https://www.tripadvisor.com.sg/ShowUserReviews-g294265-d17237163-r741058088-Jewel_Changi_Airport-Singapore.html
Jewel Changi Airport,Gismotravel,Loved Jewel,40,20-Jan-20,"Amazing - we loved exploring the canopy and the mirror maze. We had dinner downstairs in the food court which was clean, delicious and reasonably priced. We were also able to arrange point of pick up for grab car without having to venture back to the terminal. Unfortunately we had to play tag team to look around as we needed for someone to mind the suitcases and bags. As a family of 4 it was way to expensive to pay for storage.",https://media-cdn.tripadvisor.com/media/photo-l/1a/8a/dd/53/caption.jpg,https://www.tripadvisor.com.sg/ShowUserReviews-g294265-d17237163-r740081558-Jewel_Changi_Airport-Singapore.html
Jewel Changi Airport,Moses P,Impressive Indoor Waterfall,40,18-Jan-20,"The Jewel is within the Airport Complexes, a short distance from the Arrival at Terminal 1. It has a Mall with an impressive waterfall coming from the glass ceiling of a dome. It is surrounded by greenery. I has a high humidity. There are railway tracks for small trains to travel within the dome. As with all Malls, there are restaurants, cafes, bars and shops. It is worth a visit as there are no other in the world (as far as I know).I was there very early when I landed at 9.00am in Singapore. It is a popular place and gets crowded. Enjoy!",https://media-cdn.tripadvisor.com/media/photo-l/0f/f6/51/41/moses-p.jpg,https://www.tripadvisor.com.sg/ShowUserReviews-g294265-d17237163-r739795131-Jewel_Changi_Airport-Singapore.html
Jewel Changi Airport,Regina302,Mall with indoor waterfall,40,17-Jan-20,"Directly go to Jewel Changi after arrived in Terminal 4, this place was really huge and still feels good because it's indoor and the AC is cooling properly. Too bad that the 2nd level of waterfall which is I just known called rain vortex is under maintenance, but the 1st level is still there. It's really crowded when I visit this place but it's still acceptable.",https://media-cdn.tripadvisor.com/media/photo-o/07/c7/26/fa/regina302.jpg,https://www.tripadvisor.com.sg/ShowUserReviews-g294265-d17237163-r739562440-Jewel_Changi_Airport-Singapore.html
Jewel Changi Airport,robby321,Very cool,40,15-Jan-20,"Very hot and humid but very cool to see cascading water like this. It's no Niagara Falls, but this made for a nice first impression to Singapore. It's just really really crowded. The mall it is inside of is real nice.",https://media-cdn.tripadvisor.com/media/photo-l/02/9c/59/57/robby321.jpg,https://www.tripadvisor.com.sg/ShowUserReviews-g294265-d17237163-r739172991-Jewel_Changi_Airport-Singapore.html
Jewel Changi Airport,Lord_Dehf,Very different,40,7-Jan-20,"Visiting the waterfall is a must. I wouldn't recommend eating here though, it's very expensive compared to downtown.",https://media-cdn.tripadvisor.com/media/photo-l/15/c6/f8/24/lord-dehf.jpg,https://www.tripadvisor.com.sg/ShowUserReviews-g294265-d17237163-r737438946-Jewel_Changi_Airport-Singapore.html
Jewel Changi Airport,KylieIsTravelling,Airport departure visit,40,4-Jan-20,"I visited Jewel on my way home from Singapore and got to the airport especially to check out Jewel.There's a lot to see here - apart from the Rain Vortex, there are activities available on level 5 / the top floor which unfortunately you have to pay for (I didn't this time), there's a hotel where you can book a room for a few hours to dump your bags, have a snooze and refresh, and there is a massive amount of shops and eateries here - so much choice.Due to it being Christmas time whenI visited, they had a Christmas market section on level 5.Concierge staff are very helpful and there are plenty of signs available to navigate your way around Jewel. There's also plenty of lifts for people with strollers or in wheelchairs, and the bathrooms are delightfully decorated.Well worth visiting if you have the time to spare when arriving or departing the airport.",https://media-cdn.tripadvisor.com/media/photo-l/08/ff/28/4b/kylieistravelling.jpg,https://www.tripadvisor.com.sg/ShowUserReviews-g294265-d17237163-r736694283-Jewel_Changi_Airport-Singapore.html
